395,10,"426 Columbus Ave, New York, NY 10024",Documentary,Documentary,,Margaret Mead Film Festival,https://www.amnh.org/explore/margaret-mead-film-festival,https://filmfreeway.com/MargaretMeadFilmFestival,,tbd,tbd,New York,NY,tbd,tbd,,,,,,x,,,,,,,,,,,,,,,,,,,,,,,
396,,"9 State Road Chilmark, MA 02535",General,General,,Martha's Vinyard Film Festival,http://tmvff.org/,https://filmfreeway.com/MarthasVineyardFilmFestival,Postponed,3/19/2020,3/22/2020,Chillmark,MA,10/18/2019,12/18/2019,,,x,,x,,,,,,,,,,,,,,,,,,,,,,,,
877,,"79 Beach Road, Tisbury, Massachusetts 02568",General,General,,Martha's Vinyard International Film Festival,http://mvfilmsociety.com/festivals/marthas-vineyard-international-film-festival/,https://filmfreeway.com/MarthasVineyardInternationalFilmFestival,Switched to hybrid festival,9/8/2020,9/13/2020,Vineyard Haven,MA,7/1/2020,7/15/2020,,,,,x,,,,,,,,,,,,,,,,,,,,,,,,
397,,"5 West North Avenue, Baltimore, Maryland 21201",General,General,,Maryland Film Festival,https://mdfilmfest.com/,https://filmfreeway.com/TheMarylandFilmFestival,Theater temporarily closed (indefinitely),4/29/2020,5/3/2020,Baltimore,MD,10/4/2019,1/10/2020,,,,,x,,,,,,,,,,,,,,,,,,,,,,,,
398,,"36 South Potomac Street Suite 201 Hagerstown, MD 21740 United States",General,General,,Maryland International Film Festival,https://www.marylandiff.com/,https://filmfreeway.com/MarylandInternationalFilmFestival,Postponed,3/27/2020,3/29/2020,Hagerstown,MD,10/31/2019,1/31/2020,,,,,x,,,,,,,,,,,,,,,,,,,,,,,,
399,,"7 Medford Street, Arlington, Massachusetts 02474",General,General,,"Massachusettes Independent Film Festival, The ",http://www.massiff.org/,https://filmfreeway.com/theMassachusettsIndependentFilmFestival,,9/10/2020,9/12/2020,Arlington,MA,1/5/2020,7/12/2020,,,,,x,,,,,,,,,,,,,,,,,,,,,,,,
814,,"Paia, HI 96779",General,General,,Maui Film Festival,https://www.mauifilmfestival.com/,https://filmfreeway.com/MauiFilmFestival,Postponed; exploring future dates,6/17/2020,6/21/2020,Maui,HI,12/31/2019,5/15/2020,,,,,x,,,,,,,,,,,,,,,,,,,,,,,,
400,,"801 SW Baker St McMinnville, OR 97128 United States",Short,Short,,McMinnville Short Film Festival,http://mcminnvillefilmfest.org/,https://filmfreeway.com/McMinnvilleShortFilmFestival,,2/21/2020,2/23/2020,McMinnville,OR,10/1/2019,12/1/2019,,,,,,,x,,,,,,,,,,,,,,,,,,,,,,
401,,"286 Jones Dr. Milledgeville, Georgia 31062 United States",General,General,,ME Film Festival,https://www.milledgevillefilmfest.com/,https://filmfreeway.com/MEFilmFestival,New Dates: Nov 2-8,5/18/2020,5/24/2020,Milledgeville,GA,5/31/2019,1/31/2020,,,,,x,,,,,,,,,,,,,,,,,,,,,,,,
764,,"104 East State Street, Media, Pennsylvania 19063",Short,Short,,Media Film Festival,http://www.mediafilmfestival.org/,https://filmfreeway.com/MediaFilmFestival,Postponed,4/2/2020,4/4/2020,Media,PA,9/3/2019,1/3/2020,,,,,,,x,,,,,,,,,,,,,,,,,,,,,,
940,,"1800 West Hibiscus Blvd., Melbourne, FL 32901 United States",Short,Short,,"Melbourne Independent Filmmakers Festival, The",http://www.melbournefilmfest.com,https://filmfreeway.com/TheMelbourneIndependentFilmmakersFestival,,10/22/2020,10/24/2020,Melbourne,FL,2/10/2020,7/4/2020,,,,,,,x,,,,,,,,,,,,,,,,,,,,,,
402,,"Mendocino, California 95460",General,General,,Mendocino Film Festival,http://www.mendocinofilmfestival.org,https://filmfreeway.com/MendocinoFilmFestival,Postponed until next year (2020 fest canceled),5/28/2020,5/31/2020,Mendocino,CA,9/30/2019,12/20/2019,,,,,x,,,,,,,,,,,,,,,,,,,,,,,,
403,,"5777 W. Century Blvd S1070 Los Angeles, CA 90045 United States",Misc. Niche,Misc. Niche,,"Method Fest Independent Film Festival, The ",http://www.methodfest.com/,https://filmfreeway.com/TheMethodFestIndependentFilmFestival,Postponed,3/20/2020,3/26/2020,Los Angeles,CA,9/1/2019,2/14/2020,,,,,,,,,,,,,,,,,,,,,,,x,,,,,,
752,,"300 NE 2nd Ave, Miami, FL 33132",General,General,,Miami Film Festival,https://miamifilmfestival.com/,https://filmfreeway.com/MiamiFilmFestival,Ended festival early,3/6/2020,3/15/2020,Miami,FL,6/29/2019,10/15/2019,,,,,x,,,,,,,,,,,,,,,,,,,,,,,,
1017,,"1130 Washington Avenue, Miami Beach, Florida 33139",General,General,,Miami Independent Film Festival,http://miamindiefest.com,https://filmfreeway.com/miamindiefest/,,6/5/2020,7/5/2020,Miami Beach,FL,11/10/2019,11/30/2019,,,,,x,,,,,,,,,,,,,,,,,,,,,,,,
404,,"7452 SW 166th Terrace Palmetto Bay, FL 33157 United States","Genre - (SciFi, Fantasy, Thriller, Horror, etc.)",Genre,,Miami International Science Fiction Film Festival,https://miscifi.com/,https://filmfreeway.com/miscifi,,2/14/2020,2/16/2020,Miami,FL,6/21/2019,12/24/2019,,,,,,,,,,,,,,,,,x,,,,,,,,,,,,
405,,"4200 Biscayne Blvd, Miami Fl 33137",Jewish,Jewish,,Miami Jewish Film Festival ,https://miamijewishfilmfestival.org/,https://filmfreeway.com/MiamiJewishFilmFestival,,1/9/2020,1/20/2020,Miami,FL,4/30/2019,10/4/2019,,,,,,,,,,x,,,,,,,,,,,,,,,,,,,
406,,"300 Southeast 3rd Street, Miami, Florida 33131",Short,Short,,Miami Short Film Festival,http://www.miamishortfilmfestival.com/,https://filmfreeway.com/MIAMISHORTFILMFESTIVAL,,11/9/2020,11/14/2020,Miami,FL,2/15/2020,8/30/2020,,,x,,,,x,,,,,,,,,,,,,,,,,,,,,,
819,10,"Middleburg, VA 20118-1566",General,General,,Middleburg Film Festival,https://www.middleburgfilm.org/,https://filmfreeway.com/MiddleburgFilmFestival,,10/15/2020,10/18/2020,Middleburg,VA,6/1/2020,8/15/2020,,,,,x,,,,,,,,,,,,,,,,,,,,,,,,
407,,"68 S. Pleasant St., Middlebury, VT 05753",General,General,,Middlebury New Filmmakers Festival ,https://middfilmfest.org/,https://filmfreeway.com/MiddleburyNewFilmmakersFestival,Switched to online,8/27/2020,8/30/2020,Middlebury,VT,1/26/2020,5/28/2020,,,,,x,,,,,,,,,,,,,,,,,,,,,,,,
408,,"315 South Barstow Street, Eau Claire, Wisconsin 54701","Genre - (SciFi, Fantasy, Thriller, Horror, etc.)",Genre,,Midwest WeirdFest,http://www.midwestweirdfest.com/,https://filmfreeway.com/MidWestWeirdFest,,3/6/2020,3/8/2020,Eau Claire,WI,7/31/2019,1/17/2020,,,,,,,,,,,,,,,,,x,,,,,,,,,,,,
409,10,"1001 Lootens Place Suite 220 San Rafael, CA 94901 United States",General,General,,Mill Valley Film Festival,https://www.mvff.com/,https://filmfreeway.com/MillValleyFilmFestival,Switched to online,10/8/2020,10/18/2020,San Rafael,CA,5/15/2020,9/11/2020,,,x,,x,,,,,,,,,,,,,,,,,,,,,,,,
410,10,"1037 West McKinley Ave, Milwaukee, WI 53205",General,General,,Milwaukee Film Festival ,https://mkefilm.org/,https://mkefilm.org/for-filmmakers/call-for-entries,Switched to virtual,10/15/2020,10/29/2020,Milwaukee,WI,7/6/2020,7/6/2020,,,x,,x,,,,,,,,,,,,,,,,,,,,,,,,
411,9,"2900 W. Center St., Milwaukee, WI 53210",Jewish,Jewish,,Milwaukee Jewish Film Festival,https://www.jccmilwaukee.org/filmfestival,---,,tbd,tbd,Milwaukee,WI,tbd,tbd,,,,,,,,,,x,,,,,,,,,,,,,,,,,,,
412,,"2324 W Wisconsin Ave #66 Milwaukee, Wisconsin 53233 United States",Short,Short,,Milwaukee Short Film Festival,http://www.milwaukeeindependentfilmsociety.org/,https://filmfreeway.com/MilwaukeeShortFilmFestival,"Switched to ""best of"" virtual event of past film selections. 2020 submissions held until next year",9/11/2020,9/12/2020,Milwaukee,WI,1/31/2020,6/30/2020,,,,,,,x,,,,,,,,,,,,,,,,,,,,,,
874,,"5906 West Vliet Street, Milwaukee, Wisconsin 53208","Genre - (SciFi, Fantasy, Thriller, Horror, etc.)",Genre,,Milwaukee Twisted Dreams Film Festival,http://www.twisteddreamsff.com,https://filmfreeway.com/MilwaukeeTwistedDreamsFilmFestival,New Dates: June 18-21,4/16/2020,4/19/2020,Milwaukee,WI,9/30/2019,1/20/2020,,,,,,,,,,,,,,,,,x,,,,,,,,,,,,
413,,"2400 E. Kenwood Ave Milwaukee, WI 53211 United States",Underground,Underground,,Milwaukee Underground Film Festival,https://milwaukeeundergroundfilm.org/,https://filmfreeway.com/MilwaukeeUndergroundFilmFestival,Postponed (Sept. dates TBD),4/23/2020,4/26/2020,Milwaukee,WI,2/4/2020,2/4/2020,,,,,,,,,,,,,,,,,,,x,,,,,,,,,,
414,,"125 SE Main Street Suite 341 Minneapolis, MN 55414 United States",General,General,,Minneapolis-St. Paul International Film Festival,https://mspfilm.org/festivals/mspiff/,https://filmfreeway.com/mspiff,Postponed,4/9/2020,4/30/2020,Minneapolis,MN,8/16/2019,12/31/2019,,,x,,x,,,,,,,,,,,,,,,,,,,,,,,,
415,,"Missoula, MT 59807","Genre - (SciFi, Fantasy, Thriller, Horror, etc.)","Short, Genre",,MisCon International Short Film Festival,http://www.miscon.org/filmfestival/,https://filmfreeway.com/MisConInternationalShortFilmFestival,Canceled,5/22/2020,5/25/2020,Missoula,MT,4/1/2020,4/1/2020,,,,,,,x,,,,,,,,,,x,,,,,,,,,,,,
1011,11,"28 E 1st St, New York, NY 10003","Experimental, Video Art (etc)","LGBTQ+, Experimental, Video Art (etc)",,MIX Fest,https://www.mixnyc.org/,https://www.mixnyc.org/,,tbd,tbd,New York,NY,tbd,tbd,,,,,,,,,x,,,,,,,,,,,,,,,,,,,,x
416,,"25 Roxbury Street, Suite 207 Keene, NH 03431 United States",General,General,,Monadnock International Film Festival,https://www.moniff.org/,https://filmfreeway.com/MonadnockInternationalFilmFestival,Postponed,4/24/2020,4/26/2020,Keene,NH,10/18/2019,1/10/2020,,,,,x,,,,,,,,,,,,,,,,,,,,,,,,
848,9,"525 Lighthouse Avenue, Pacific Grove, California 93950",General,General,,Monarch Film Festival,http://monarchfilmfestival.com,https://filmfreeway.com/MonarchFilmFestival,Postponed until December,9/11/2020,9/12/2020,Pacific Grove`,CA,3/15/2020,6/15/2020,,,,,x,,,,,,,,,,,,,,,,,,,,,,,,
417,,"21 Bridge Avenue, Red Bank, New Jersey 07701",General,General,,Monmouth Film Festival,https://www.monmouthfilmfestival.org/,https://filmfreeway.com/MonmouthFilmFestival,Switched to virtual,8/14/2020,8/16/2020,Red Bank,NJ,1/12/2020,6/13/2020,,,,,x,,,,,,,,,,,,,,,,,,,,,,,,
999,,"302 Bedford Ave, Brooklyn, NY 11249 United States","Experimental, Video Art (etc)","Experimental, Video Art (etc)",,MONO NO AWARE,http://mononoawarefilm.com/,https://filmfreeway.com/MONONOAWARE,,12/3/2020,12/12/2020,Brooklyn,NY,10/31/2020,10/31/2020,,,,,,,,,,,,,,,,,,,,,,,,,,,,,x
881,,"718 South Higgins Avenue, Missoula, MT 59801",General,General,,Montana Film Festival,www.montanafilmfestival.org,https://filmfreeway.com/MontanaFilmFestival,Switched to virtual,10/8/2020,10/11/2020,Missoula,MT,4/1/2020,7/26/2020,,,,,x,,,,,,,,,,,,,,,,,,,,,,,,
762,,"505 Bloomfield Avenue, Montclair, NJ 07042",General,General,,Montclair Film Festival,https://montclairfilm.org/,https://filmfreeway.com/MontclairFilm,Postponed,5/1/2020,5/10/2020,Montclair,NJ,11/15/2019,1/17/2020,,,x,,x,,,,,,,,,,,,,,,,,,,,,,,,
878,0,"1045 East Fairview Avenue, Montgomery, Alabama 36106",Short,Short,,Montgomery Film Festival,http://www.montgomeryfilmfestival.com/,https://filmfreeway.com/MontgomeryFilmFestival,,7/24/2020,7/25/2020,Montgomery,AL,3/25/2020,5/27/2020,,,,,,,x,,,,,,,,,,,,,,,,,,,,,,
418,,"118 North Main Street, Rockford, Illinois 61101",General,General,,Mosaic World Film Festival,http://mosaicfilmfest.com/,https://filmfreeway.com/MosaicWorldFilmFestival,Switched to online,9/18/2020,9/20/2020,Rockford,IL,12/31/2019,5/30/2020,,,,,x,,,,,,,,,,,,,,,,,,,,,,,,
419,,"21111 Haggerty Road, Novi, Michigan 48375","Genre - (SciFi, Fantasy, Thriller, Horror, etc.)",Genre,,Motor City Nightmares International Film Festival,http://motorcitynightmares.com/,https://filmfreeway.com/MCNFF,New Dates: July 24-26,4/24/2020,4/26/2020,Novi,MI,10/31/2019,2/14/2020,,,,,,,,,,,,,,,,,x,,,,,,,,,,,,
420,9,"4557 Colfax Ave North Hollywood, California 91602 United States","Environment, Outdoor, Adventure, Wildlife",Environmental/Outdoor/Adventure/Wildlife,,Mountain & Adventure Film Festival,https://filmfestivalflix.com/festival/maff-gathering/#.XBrEqRNKh-U,https://filmfreeway.com/MountainAndAdventureFilmFestival,,tbd,tbd,North Hollywood,CA,tbd,tbd,,,, ,,,,,,,,,,,,,,,,,,,,x,,,,,
421,,"109 E. Colorado Suite 1 Telluride, CO 81435",Documentary,"Documentary, Environmental/Outdoor/Adventure/Wildlife",,Mountainfilm,https://www.mountainfilm.org/,https://filmfreeway.com/Mountainfilm,Moved to fully online,5/22/2020,5/25/2020,Telluride,CO,12/13/2019,2/3/2020,,,,,,x,,,,,,,,,,,,,,,,,,x,,,,,
422,5,"3315 N. 2nd St., Harrisburg, PA 17110",Underground,Underground,,Movieate Underground Film Festival,http://www.moviate.org/,https://filmfreeway.com/Moviate,Postponed,5/22/2020,5/24/2020,Harrisburg,PA,3/15/2020,3/15/2020,,,,,,,,,,,,,,,,,,,x,,,,,,,,,,
423,11,"2786 Shamrock Dr. Muscatine, IA 52761 United States",Short,Short,,Muscatine Independent Film Festival,https://muscatinefilmfest.com/,https://filmfreeway.com/MuscatineIndependentFilmFestival,,tbd,tbd,Muscatine,IA,tbd,tbd,,,,,,,x,,,,,,,,,,,,,,,,,,,,,,
849,12,"1278 Glenneyre St., Laguna Beach, CA 92651-3103",Student,"Short, Student",,My HERO International Short Film Festival,https://myhero.com/films,https://filmfreeway.com/MYHEROIFF,New Dates: Dec 12-13,6/28/2020,7/1/2020,Laguna Beach,CA,2/1/2020,5/1/2020,,,,,,,x,,,,,,,,,,,,,,,x,,,,,,,
424,,"4002 Deville Street, Myrtle Beach, South Carolina 29577",General,General,,Myrtle Beach International Film Festival,http://www.myrtlebeachfilmfestival.com/,https://filmfreeway.com/MyrtleBeachInternationalFilmFestival,Postponed (planning to reschedule when theaters reopen),4/21/2020,4/25/2020,Myrtle Beach,SC,9/27/2019,12/27/2019,,,,,x,,,,,,,,,,,,,,,,,,,,,,,,
425,,"3735 Franklin Road SW Suite 228 Roanoke, VA 24014 United States","Genre - (SciFi, Fantasy, Thriller, Horror, etc.)",Genre,,MystiCon Independent Film Festival,http://mysticon-va.com/,https://filmfreeway.com/MystiConIndependentFilmFestival,,2/28/2020,3/1/2020,Roanoke,VA,10/31/2019,11/30/2019,,,,,,,,,,,,,,,,,x,,,,,,,,,,,,
426,,"200 North Fredonia Street, Nacogdoches, Texas 75961",General,General,,Nacogdoches Film Festival,http://www.nacogdochesfilmfestival.com,https://filmfreeway.com/NacogdochesFilmFestival,,2/20/2020,2/22/2020,Nacagdoches,TX,10/1/2019,1/1/2020,,,,,x,,,,,,,,,,,,,,,,,,,,,,,,
427,,"68 Jay Street Suite 319 Brooklyn, New York 11201 United States",General,General,,Nantucket Film Festival,http://nantucketfilmfestival.org/,https://filmfreeway.com/NantucketFilmFestival,"Switched to online, June 23-30",6/23/2020,6/29/2020,Nantucket,MA,10/18/2019,3/11/2020,,,,,x,,,,,,,,,,,,,,,,,,,,,,,,
821,11,"Napa, CA 94581",General,General,,Napa Valley Film Festival,https://www.cinemanapavalley.org/film/,https://filmfreeway.com/NapaValleyFilmFestival,,11/11/2020,11/15/2020,Napa Valley,CA,2/14/2020,6/5/2020,,,x,,x,,,,,,,,,,,,,,,,,,,,,,,,
850,10,"5833 Pelican Bay Blvd Naples, FL 34108 United States",General,General,,Naples International Film Festival,https://artisnaples.org/naples-international-film-festival/,https://filmfreeway.com/NaplesInternationalFilmFestival,,10/22/2020,10/25/2020,Naples,FL,4/30/2020,7/2/2020,,,x,,x,,,,,,,,,,,,,,,,,,,,,,,,
428,10,"161 Rains Ave. Nashville, Tennessee 37203 United States",General,General,,Nashville Film Festival,https://nashvillefilmfestival.org/,https://filmfreeway.com/NashFilm,Switched to virtual,10/1/2020,10/7/2020,Nashville,TN,3/27/2020,6/26/2020,X,X,x,,x,,,,,,,,,,,,,,,,,,,,,,,,
429,10,"801 Percy Warner Blvd., Nashville, TN 37205",Jewish,Jewish,,Nashville Jewish Film Festival,http://nashvillejff.net/,---,Switched to virtual Oct 13-Nov 5,10/13/2020,11/5/2020,Nashville,TN,---,---,,,,,,,,,,x,,,,,,,,,,,,,,,,,,,
430,,"1600 6th Street Parker, Arizona 85344 United States","Native American, Indigenous (etc)",Native American/Indigenous,,NatiVisions Film Festival,http://www.nativisions.com/,https://filmfreeway.com/NatiVisionsFilmFestival-915947,,9/24/2020,9/26/2020,Parker,AZ,5/29/2020,7/24/2020,,,,,,,,,,,,,,x,,,,,,,,,,,,,,,
431,0,"Durham, NC 27709","Asian, As. Am. (etc)",Asian/Asian American,,NC South Asian Film Festival,https://www.facebook.com/groups/ncisaff/,https://filmfreeway.com/ncisaff,,1/29/2020,1/29/2020,Durham,NC,3/31/2020,9/17/2020,,,,,,,,,,,,x,,,,,,,,,,,,,,,,,
432,,"3111 Saunders Settlement Rd Sanborn, New York 14132 United States",General,General,,NCCC Film & Animation Festival,http://www.niagaracc.suny.edu/ncccfilmfestival/,https://filmfreeway.com/NCCCFilmFestival,New Date: Nov 21,5/9/2020,5/9/2020,Sanborn,NY,4/1/2020,4/1/2020,,,,,x,,,,,,,,,,,,,,,,,,,,,,,,
433,,"Nevada City, CA 95959",General,General,,Nevada City Film Festival,http://www.nevadacityfilmfestival.com/,https://filmfreeway.com/NevadaCityFilmFestival,Switched to Drive in & Streaming,8/28/2020,9/4/2020,Nevada City,CA,tbd,tbd,,,,,x,,,,,,,,,,,,,,,,,,,,,,,,
434,,"814 South 3rd Street, Las Vegas, Nevada 89101",Women's,Women's,,Nevada Women's Film Festival,https://www.nwffest.com/,https://filmfreeway.com/NevadaWomensFilmFestival,Postponed,3/19/2020,3/22/2020,Las Vegas,NV,8/31/2019,12/31/2019,,,,,,,,x,,,,,,,,,,,,,,,,,,,,,
435,,"309 West Morgan Street Durham, NC 27701 United States","Genre - (SciFi, Fantasy, Thriller, Horror, etc.)",Genre,,Nevermore Film Festival,http://www.carolinatheatre.org/films/festivals/nevermore,https://filmfreeway.com/NevermoreFilmFestival,,2/28/2020,3/1/2020,Durham,NC,11/8/2019,12/2/2019,,,,,,,,,,,,,,,,,x,,,,,,,,,,,,
436,3,"20 Lincoln Center Plaza, New York, NY 10023",General,General,,New Directors/New Films,http://www.newdirectors.org/,---,Postponed,3/25/2020,4/5/2020,New York,NY,---,---,,X,,,x,,,,,,,,,,,,,,,,,,,,,,,,
437,10,"155 Fleet St Portsmouth, NH 03801 United States",General,General,,New Hampshire Film Festival ,https://nhfilmfestival.com/,https://filmfreeway.com/NewHampshireFilmFestival,Postponed until October 2021,10/15/2020,10/18/2020,Portsmouth,NH,5/15/2020,9/1/2020,,,,,x,,,,,,,,,,,,,,,,,,,,,,,,
438,,"66 Hanover St #300, Manchester, NH 03101",Jewish,Jewish,,New Hampshire Jewish Film Festival,http://www.nhjewishfilmfestival.org/,---,Postponed,3/19/2020,3/29/2020,Manchester,NH,---,---,,,,,,,,,,x,,,,,,,,,,,,,,,,,,,
439,5,"20 Church Street, New Haven, Connecticut 06510",General,General,,New Haven International Film Festival,http://www.newhavenfilmfestival.com/,https://filmfreeway.com/NewHavenFilmFestival,,tbd,tbd,New Haven,CT,tbd,tbd,,,,,x,,,,,,,,,,,,,,,,,,,,,,,,
440,,"6542-A Lower York Rd. #219 New Hope, PA 18938 United States",General,General,,New Hope Film Festival,https://newhopefilmfestival.com/,https://filmfreeway.com/NewHopeFilmFestival,2020 screenings postponed to July 2021,7/17/2020,7/26/2020,New Hope,PA,9/20/2019,2/28/2020,,,,,x,,,,,,,,,,,,,,,,,,,,,,,,
441,,"71 Hamilton Street, New Brunswick, New Jersey 08901",General,General,,New Jersey International Film Festival,http://www.njfilmfest.com/,https://filmfreeway.com/NewJerseyInternationalFilmFestival,,1/24/2020,2/23/2020,New Brunswick,NJ,7/25/2019,10/25/2019,,,,,x,,,,,,,,,,,,,,,,,,,,,,,,
442,,"760 Northfield Ave West Orange, New Jersey 07052 United States",Jewish,Jewish,,New Jersey Jewish Film Festival,https://jccmetrowest.org/programs/njjff/,https://filmfreeway.com/njjff,Postponed,3/19/2020,3/29/2020,West Orange,NJ,10/14/2019,12/14/2019,,,,,,,,,,x,,,,,,,,,,,,,,,,,,,
443,,"2355 Westwood Blvd. #381 Los Angeles, CA 90064 United States",Misc. Niche,Misc. Niche,,New Media Film Festival,https://www.newmediafilmfestival.com/,https://filmfreeway.com/NewMediaFilmFestival,"New Dates: Feb 3-4, 2021",6/3/2020,6/4/2020,Los Angeles,CA,9/3/2019,4/3/2020,,,,,,,,,,,,,,,,,,,,,,,x,,,,,,
444,10,"1215 Prytania Street Suite 423 New Orleans, LA 70130 United States",General,General,,New Orleans Film Festival,https://neworleansfilmsociety.org/,https://filmfreeway.com/NewOrleansFilmFestival,New Dates: Nov 4-22,10/14/2020,10/21/2020,New Orleans,LA,1/10/2020,6/19/2020,X,X,x,,x,,,,,,,,,,,,,,,,,,,,,,,,
957,5,"144 West 65th Street, New York, New York 10023 United States","Black, African, Afr. Am. (etc)",Black/African/African American,,New York African Film Festival,http://africanfilmny.org,https://filmfreeway.com/NYAFF27,Postponed (planning to hold events when safe),5/15/2020,5/31/2020,New York,NY,1/4/2020,2/4/2020,,,,,,,,,,,x,,,,,,,,,,,,,,,,,,
445,12,"86 Broadway Woodcliff Lake, NJ 07677",Horror,Horror,,"New York City Horror Film Festival, The",https://nychorrorfest.com/,https://filmfreeway.com/NewYorkCityFilmFestival,,12/3/2020,12/6/2020,New York,NY,2/15/2020,9/1/2020,,,,,,,,,,,,,,,,,,x,,,,,,,,,,,
446,,"358 West 44th Street Second Floor (Producers Club) New York, NY 10036 United States",General,General,,New York City Independent Film Festival,https://www.nycindieff.com/,https://filmfreeway.com/NYCIndieFF,New Dates: May 31-Jun7,5/10/2020,5/17/2020,New York,NY,8/31/2019,2/5/2020,,,,,x,,,,,,,,,,,,,,,,,,,,,,,,
447,,"1350 6th Avenue, New York, New York 10019",General,General,,New York City International Film Festival,http://www.nyciff.com/,https://filmfreeway.com/NEWYORKCITYINTERNATIONALFILMFESTIVALNYCIFF,Postponed,3/23/2020,3/27/2020,New York,NY,6/30/2019,1/20/2020,,,,,x,,,,,,,,,,,,,,,,,,,,,,,,
989,10,"189 2nd Avenue, New York, NY 10003 United States",Misc. Niche,Misc. Niche,,New York City Mental Health Film Festival,http://www.mentalhealthfilmfest.nyc,https://filmfreeway.com/NYCMentalHealthFilmFestival,,10/3/2020,10/3/2020,New York,NY,3/31/2020,8/31/2020,,,,,,,,,,,,,,,,,,,,,,,x,,,,,,
448,,"358 West 44th Street Producers Club New York, NY 10036 United States",Comedy,"Short, Comedy",,New York City Short Comedy Film Festival,http://nycscff.com/,https://filmfreeway.com/NYCSCFF,Events Canceled; Virtual festival TBA,3/22/2020,3/22/2020,New York,NY,7/31/2019,1/31/2020,,,,,,,x,,,,,,,,,,,,,,x,,,,,,,,
449,10,"New York, NY United States",Short,Short,,New York City Short Film Festival,http://www.nycshorts.com/,https://filmfreeway.com/NewYorkCityShortFilmFestivalNYCShorts,,tbd,tbd,New York,NY,tbd,tbd,,,,,,,x,,,,,,,,,,,,,,,,,,,,,,
450,10,"70 Lincoln Center Plaza, New York, NY 10023",General,General,,New York Film Festival,https://www.filmlinc.org/,---,,tbd,tbd,New York,NY,tbd,tbd,,,,,x,,,,,,,,,,,,,,,,,,,,,,,,
451,,"303 Fifth Avenue, Suite 1007, New York, NY 10016","Misc. Ethnic, Cultural, Foreign Focus (etc)",Misc. Ethnic/Cultural/Foreign Focus,,New York Indian Film Festival,http://www.iaac.us/,https://filmfreeway.com/NYIFF20,Postponed,4/27/2020,5/3/2020,New York,NY,11/15/2019,2/29/2020,,,,,,,,,,,,,,,,x,,,,,,,,,,,,,
452,,"225 Broadway, #2730 New York, New York 10007 United States",Children's,Children's,,New York International Childrens Film Festival,https://nyicff.org/,https://filmfreeway.com/NYICFF,Canceled final weekend,2/21/2020,3/15/2020,New York,NY,9/9/2020,11/11/2020,X,,,,,,,,,,,,,,,,,,,,,,,,,x,,,
453,,"144 W 65th St, New York, NY 10023",Jewish,Jewish,,New York Jewish Film Festival,https://www.filmlinc.org/festivals/new-york-jewish-film-festival/,---,,1/15/2020,1/28/2020,New York,NY,8/8/2019,8/8/2019,,,,,,,,,,x,,,,,,,,,,,,,,,,,,,
1023,,"630 Second Ave, New York, NY 10016","Misc. Ethnic, Cultural, Foreign Focus (etc)","Misc. Ethnic, Cultural, Foreign Focus (etc)",,New York Kurdish Film and Cultural Festival ,www.nykfcf.com,https://www.nykfcf.com/index/content/call-for-submission/,,tbd,tbd,New York City,NY,tbd,tbd,,,,,,,,,,,,,,,,x,,,,,,,,,,,,,
967,8,"234 West 42nd Street, New York, New York 10036 United States","Latino, Latin American (etc)","Latino, Latin American (etc)",,New York Latino Film Festival,http://nylatinofilmfestival.com,https://filmfreeway.com/NewYorkLatinoFilmFestival,Switched to online & Drive-in Sept 14-20,8/12/2020,8/16/2020,New York,NY,3/15/2020,5/15/2020,,,,,,,,,,,,,x,,,,,,,,,,,,,,,,
454,,"308 Bedford Avenue Brooklyn, New York 11211",General,General,,New York Lift-Off Film Festival,https://liftoff.network/,https://filmfreeway.com/NewYorkLiftOffFilmFestival,"Switched to online, July 1",6/21/2020,6/28/2020,Brooklyn,NY,8/12/2019,5/11/2020,,,,,x,,,,,,,,,,,,,,,,,,,,,,,,
455,,"15 West 16th Street New York, NY 10011",Jewish,Jewish,,New York Sephardic Jewish Film Festival,http://nysephardifilmfestival.org/,https://filmfreeway.com/NewYorkSephardicFilmFestival,,2/18/2020,2/27/2020,New York,NY,9/21/2019,9/21/2019,,,,,,,,,,x,,,,,,,,,,,,,,,,,,,
456,,"22 E. 12th St., New York, New York 10003",Short,Short,,New York Shorts International Film Festival,https://www.nyshorts.net/,https://filmfreeway.com/NYshorts,New Dates: Aug 21-27,5/29/2020,6/4/2020,New York,NY,1/17/2020,4/17/2020,,,,,,,x,,,,,,,,,,,,,,,,,,,,,,
810,,"339 Central Avenue, Albany, New York 12206",Short,Short,,New York State International Film Festival,http://www.nysiff.com/,https://filmfreeway.com/NYSIFF,Switched to online Sept 25 - Oct 9,9/25/2020,9/26/2020,Albany,NY,11/30/2019,8/2/2020,,,,,,,x,,,,,,,,,,,,,,,,,,,,,,
457,,"6 E 70th St, New York, NY 10021","Environment, Outdoor, Adventure, Wildlife",Environmental/Outdoor/Adventure/Wildlife,,New York WILD Film Festival,http://www.nywildfilmfestival.com/,https://filmfreeway.com/NewYorkWILDFilmFestival,,2/27/2020,3/1/2020,New York,NY,6/10/2019,9/30/2019,,,, ,,,,,,,,,,,,,,,,,,,,x,,,,,
458,6,"49 Washington Street, Newark, NJ, 07102-3176","Black, African, Afr. Am. (etc)",Black/African/African American,,Newark Black Film Festival,https://www.newarkmuseum.org/nbff,---,Canceled,7/9/2020,7/11/2020,Newark,NJ,3/18/2020,3/18/2020,,,,,,,,,,,x,,,,,,,,,,,,,,,,,,
911,9,"1 Market Square, Newburyport, Massachusetts 01950 United States",Documentary,Documentary,,Newburyport Documentary Film Festival,https://www.nbptdocufest.org,https://filmfreeway.com/NewburyportDocumentaryFilmFestival,Switched to virtual Sept 18-24,9/18/2020,9/20/2020,Newburyport,MA,4/17/2020,6/19/2020,,,x,,,x,,,,,,,,,,,,,,,,,,,,,,,
879,10,"601 West 26th Street, New York, NY 10001",LGBTQ+,LGBTQ+,,NewFest: New York's LGBTQ Film Festival,https://newfest.org/,https://filmfreeway.com/newfest,,10/21/2020,10/27/2020,New York City,NY,4/21/2020,7/27/2020,,,,,,,,,x,,,,,,,,,,,,,,,,,,,,
459,,"2000 Quail Street Newport Beach, CA 92660-1815 United States",General,General,,Newport Beach Film Festival,https://newportbeachfilmfest.com/,https://filmfreeway.com/NewportBeachFilmFestival,New Dates: Aug 6-13,4/23/2020,4/30/2020,Newport Beach,CA,9/27/2019,2/7/2020,,,,,x,,,,,,,,,,,,,,,,,,,,,,,,
983,10,"511 Queen Anne Avenue North, Seattle, Washington 98109, United States",Student,Student,,NFFTY (National Film Festival for Talented Youth),https://www.nffty.org,https://filmfreeway.com/NFFTY,,10/22/2020,10/25/2020,Seattle,WA,4/10/2020,7/17/2020,,,,,,,,,,,,,,,,,,,,,,x,,,,,,,
