Object ID,Last Year's Month,ADDRESS,Primary Category for Calendar,Category,GA,Festival Name,Website,FilmFreeway / Submissions,Date Changes & Cancellations due to COVID-19,Start Date,End Date,City,State,First Submission Deadline,Last Submission Deadline,Oscar Qualifying (Short Subject),Oscar Qualifying (Doc Short),Film Fest Alliance,Category Start,General,Documentary,Short,Women's,LGBTQ+,Jewish,"Black, African, Afr. Am. (etc)","Asian, As. Am. (etc)","Latino, Latin American (etc)","Native American, Indigenous (etc)","Muslim, Arab, Arab Am. (etc)","Misc. Ethnic, Cultural, Foreign Focus (etc)","Genre - (SciFi, Fantasy, Thriller, Horror, etc.)",Horror,Underground,Animation,Comedy,Student,Misc. Niche,"Environment, Outdoor, Adventure, Wildlife","Social Justice, Peace",Children's,Dance,Christian,"Experimental, Video Art (etc)"
765,,"1300 North Atlantic Avenue, Cocoa Beach, Florida 32931",Short,Short,,15 Minutes of Fame Indie Film Festival,https://etheridgeproductions.com/,https://filmfreeway.com/15MinutesofFame,,2/29/2020,2/29/2020,Cocoa Beach,FL,9/30/2019,2/6/2020,,,,,,,x,,,,,,,,,,,,,,,,,,,,,,
935,11,"352 Cypress Street, Abilene, Texas 79601 United States",Short,Short,,24fps International Short Film Festival,http://24fpsfest.com,https://filmfreeway.com/24fpsfest,,11/6/2020,11/7/2020,Abilene,TX,7/17/2020,7/17/2020,,,,,,,x,,,,,,,,,,,,,,,,,,,,,,
769,,"567 Colorado Avenue, Carbondale, Colorado 81623","Environment, Outdoor, Adventure, Wildlife","Short, Environmental/Outdoor/Adventure/Wildlife",,5Point Adventure Film Festival,https://5pointfilm.org/,https://filmfreeway.com/5PointFilmFestival,New dates: Oct 14-18,4/24/2020,4/26/2020,Carbondale,CO,11/1/2019,3/6/2020,,,, ,,,x,,,,,,,,,,,,,,,,,x,,,,,
926,,"1101 Center Avenue Mall, Fort Collins, Colorado 80521 United States",Student,"Student, Short",,ACT Human Rights Film Festival,https://actfilmfest.colostate.edu,https://filmfreeway.com/ACTHumanRightsFilmFestival,Postponed,4/3/2020,4/11/2020,Fort Collins,CO,--- ,---,,,x,,,,x,,,,,,,,,,,,,,,x,,,,,,,
1,11,"3545 Lipan Street Denver, CO 80211 United States",Misc. Niche,Misc. Niche,,Action Figure Film Festival,http://www.actionfigurefilmfestival.com/,https://filmfreeway.com/afff,,tbd,tbd,Denver,CO,tbd,tbd,,,,,,,,,,,,,,,,,,,,,,,x,,,,,,
793,,"3540 W.Sahara Ave., Las Vegas, Nv 89102",Misc. Niche,Misc. Niche,,Action On Film Festival,https://www.actiononfilmfest.com/,https://filmfreeway.com/aofmegafest,"New Dates: Online Aug 28-Sep 1, in-person* Sep 2-6",7/23/2020,8/2/2020,Las Vegas,NV,11/30/2019,7/1/2020,,,,,,,,,,,,,,,,,,,,,,,x,,,,,,
2,,"32123 Boone, NC 28608 United States",Dance,Dance,,ADF's Movies by Movers,http://www.americandancefestival.org/projects/moviesbymovers/,https://filmfreeway.com/MoviesByMovers,Canceled,6/6/2020,7/18/2020,Boone,NC,2/14/2020,2/14/2020,,,,,,,,,,,,,,,,,,,,,,,,,,,x,,
3,,"207 Glen Street, Glens Falls, New York 12801",General,General,,Adirondack Film Festival,http://www.adkfilmfestival.org/,https://filmfreeway.com/AdirondackFilmFestival,"Switched to virtual (with ""Film Festival In a Box"" experience)",10/15/2020,10/18/2020,Glen Falls,NY,1/1/2020,5/5/2020,,,,,x,,,,,,,,,,,,,,,,,,,,,,,,
4,,"2032 14th Street, Boulder, Colorado 80302",General,General,,Adventure Film Festival,http://www.adv...turefilm.org/,https://filmfreeway.com/AdventureFilmFestival,,3/26/2020,3/28/2020,Boulder,CO,4/21/2019,9/25/2019,,,,,x,,,,,,,,,,,,,,,,,,,,,,,,
5,,"8633 Colesville Road, Silver Spring, MD 20910",Documentary,Documentary,,AFI Docs,http://www.afi.com/afidocs/,https://filmfreeway.com/AFIDOCS,Switched to virtual,6/17/2020,6/21/2020,Washington,DC,11/29/2019,3/13/2020,,,x,,,x,,,,,,,,,,,,,,,,,,,,,,,
6,11,"2021 North Western Avenue, Los Angeles, CA 90027 ",General,General,,AFI Fest,http://www.afi.com/afifest/,https://filmfreeway.com/AFIFEST,Switched to virtual,10/15/2020,10/22/2020,Los Angeles,CA,2/28/2020,6/5/2020,X,,x,,x,,,,,,,,,,,,,,,,,,,,,,,,
7,11,"525 W 120th St, New York, NY 10027","Black, African, Afr. Am. (etc)",Black/African/African American,,African Diaspora International Film Festival,http://nyadiff.org/,https://filmfreeway.com/AfricanDiasporaInternationalFilmFestival,,tbd,tbd,New York,NY,tbd,tbd,,,x,,,,,,,,x,,,,,,,,,,,,,,,,,,
8,5,"154 W 18th St Suite 2A New York, New York(NY) 10011 United States","Black, African, Afr. Am. (etc)",Black/African/African American,,African Film Festival New York,https://www.africanfilmny.org,https://filmfreeway.com/NYAFF26,,tbd,tbd,New York,NY,tbd,tbd,,,,,,,,,,,x,,,,,,,,,,,,,,,,,,
9,,"3536 Grand Ave, Dallas, TX 75210","Black, African, Afr. Am. (etc)",Black/African/African American,,"African Film Festival, The",http://www.theafricanfilmfestival.org/,https://filmfreeway.com/taff,Switched to online,6/1/2020,6/6/2020,Dallas,TX,10/31/2019,1/20/2020,,,,,,,,,,,x,,,,,,,,,,,,,,,,,,
10,,"1249 Marin Ave. Albany, CA 94706 United States",Short,Short,,Albany Film Fest,http://www.albanyfilmfest.org/,https://filmfreeway.com/AlbanyFilmFest,Canceled,3/21/2020,3/29/2020,Albany,CA,9/8/2019,11/7/2019,,,,,,,x,,,,,,,,,,,,,,,,,,,,,,
830,11,"500 East Alexandria Avenue Alexandria, VA 22301 United States",General,General,,Alexandria Film Festival,http://www.alexfilmfest.com/,https://filmfreeway.com/AlexandriaFilmFestival-523023,,tbd,tbd,Alexandria ,VA,tbd,tbd,,,,,x,,,,,,,,,,,,,,,,,,,,,,,,
11,,"234 W 42nd St, New York, NY 10036",Student,Student,,All American High School Film Festival,https://www.hsfilmfest.com/,https://filmfreeway.com/HSFilmFest,Swiotched to online Oct 1-11,10/9/2020,10/11/2020,New York,NY,4/1/2020,7/3/2020,,,,,,,,,,,,,,,,,,,,,,x,,,,,,,
51,8,"1100 Dexter St, Austin, TX 78704",LGBTQ+,LGBTQ+,,"All Genders, Lifestyles, and Identities Film Festival ",https://www.agliff.org/,https://filmfreeway.com/AustinGLIFF,Switched to virtual Aug 6-16,8/6/2020,8/9/2020,Austin,TX,1/12/2020,6/7/2020,,,x,,,,,,x,,,,,,,,,,,,,,,,,,,,
1006,8,"2820 East 33rd Street, Minneapolis, Minnesota 55406","Experimental, Video Art (etc)","Short, Experimental, Video Art (etc)",,Altered Esthetics Film Festival,https://www.alteredesthetics.org/,https://filmfreeway.com/AeFilmFestival,,tbd,tbd,Minneapolis,MN,tbd,tbd,,,,,,,x,,,,,,,,,,,,,,,,,,,,,,x
12,,"1601 Collins Avenue, Miami Beach, FL 33139","Black, African, Afr. Am. (etc)",Black/African/African American,,American Black Film Festival,http://www.abff.com/,https://filmfreeway.com/AmericanBlackFilmFestival,New Dates: Oct 21-25,6/17/2020,6/21/2020,Miami Beach,FL,12/31/2019,2/1/2020,,,,,,,,,,,x,,,,,,,,,,,,,,,,,,
13,10,"Shepherdstown, WV 25443","Environment, Outdoor, Adventure, Wildlife",Environmental/Outdoor/Adventure/Wildlife,,American Conservation Film Festival,http://conservationfilmfest.org/,https://filmfreeway.com/ACFF,,3/24/2020,3/28/2020,Shepherdstown,WV,6/1/2020,9/1/2020,,,, ,,,,,,,,,,,,,,,,,,,,x,,,,,
763,,"1833 S. Araby Drive #2 Palm Springs, CA 92264 United States",Documentary,"Documentary, Animation",,American Documentary and Animation Film Festival,https://www.americandocumentaryfilmfestival.com/,https://filmfreeway.com/AmericanDocumentaryFilmFestivalandFilmFund,New Dates: Sept 25-29,3/27/2020,3/31/2020,Palm Springs,CA,6/16/2019,1/12/2020,,X,,,,x,,,,,,,,,,,,,,x,,,,,,,,,
14,,"1140 E Baseline Rd, Tempe, Arizona 85283",Horror,Horror,,American Horror Film Festival,http://www.americanhorrorfilmfestival.com/,https://filmfreeway.com/AmericanHorrorFilmFestival,,1/11/2020,1/11/2020,Tempe,AZ,2/9/2019,8/23/2019,,,,,,,,,,,,,,,,,,x,,,,,,,,,,,
15,10,"2940 - 16th Street, Suite 304 San Francisco, CA 94103 United States","Native American, Indigenous (etc)",Native American/Indigenous,,American Indian Film Festival,https://www.aifisf.com/,https://filmfreeway.com/AIFF,,11/3/2020,11/7/2020,San Francisco,CA,3/31/2020,7/31/2020,,,,,,,,,,,,,,x,,,,,,,,,,,,,,,
16,,"210 Peachtree St NW, Atlanta, GA 30303",Student,Student,,American Youth Film Festival,https://www.americanyouthfilmfest.org/,https://filmfreeway.com/AmericanYouthFilmFestival,Postponed ,6/25/2020,6/28/2020,Atlanta,GA,1/18/2020,4/4/2020,,,,,,,,,,,,,,,,,,,,,,x,,,,,,,
831,12,"200 W 34th Ave, PMB #136 Anchorage, AK 99503 United States",General,General,,Anchorage International Film Festival,http://anchoragefilmfestival.org/,https://filmfreeway.com/AnchorageInternationalFilmFestival,,12/4/2020,12/13/2020,Anchorage,AK,5/1/2020,9/15/2020,,,x,,x,,,,,,,,,,,,,,,,,,,,,,,,
17,,"5021 Highland Avenue, Downers Grove, Illinois 60515",Student,"Student, Animation",,Anim8 Student Film Festival,http://www.afterhoursfilmsociety.com/,https://filmfreeway.com/Anim8,,10/19/2020,10/19/2020,Downers Grove,IL,6/15/2020,7/31/2020,,,,,,,,,,,,,,,,,,,,x,,x,,,,,,,
18,10,"401 Broad Street, Nevada City, California 95959","Environment, Outdoor, Adventure, Wildlife",Environmental/Outdoor/Adventure/Wildlife,,Animal Film Festival,http://www.animalfilmfestival.org/,https://filmfreeway.com/AnimalFilmFestival,,tbd,tbd,Nevada City,CA,tbd,tbd,,,, ,,,,,,,,,,,,,,,,,,,,x,,,,,
19,,"1505 W Saint Mary's Road # 172 Tucson, AZ 85745 United States",Animation,"Short, Animation",,Animated Arizona Film Festival,http://animatedarizona.wixsite.com/aaff,https://filmfreeway.com/AnimatedArizonaFilmFestival,,1/18/2020,1/18/2020,Tucson,AZ,7/31/2019,11/15/2019,,,,,,,x,,,,,,,,,,,,,x,,,,,,,,,
20,9,"30 Lafayette Ave, Brooklyn, NY 11217",Animation,Animation,,Animation Block Party,http://www.ani...ionblock.com/,https://filmfreeway.com/AnimationBlockParty,,tbd,tbd,Brooklyn,NY,tbd,tbd,,,,,,,,,,,,,,,,,,,,x,,,,,,,,,
1029,,"200 North 14th Street, Brooklyn, New York 11211",Animation,"Animation, Short",,Animation Nights New York ,Http://www.animationnights.com,https://filmfreeway.com/AnimationNights,New Dates: Nov 20-22,10/3/2020,10/4/2020,New York,NY,8/1/2019,7/30/2020,,,,,,,x,,,,,,,,,,,,,x,,,,,,,,,
21,,"230 Collingwood Dr, Suite 160B, Ann Arbor, Michigan 48103",General,General,,Ann Arbor Film Festival ,https://www.aafilmfest.org/,https://filmfreeway.com/AAFilmFest,Events canceled ,3/24/2020,3/29/2020,Ann Arbor,MI,7/31/2019,10/9/2019,X,,x,,x,,,,,,,,,,,,,,,,,,,,,,,,
22,,"107 Annapolis Street Suite J Annapolis, MD 21401 United States",General,General,,Annapolis Film Festival,http://www.ann...festival.net/,https://filmfreeway.com/AnnapolisFilmFestival,Events canceled; considering creative alternatives,3/26/2020,3/29/2020,Annapolis,MD,9/15/2019,12/15/2019,,,,,x,,,,,,,,,,,,,,,,,,,,,,,,
813,12,"1746 Post St, San Francisco, CA 94115",General,General,,Another Hole in the Head Film Festival,https://www.ahith.com/,https://filmfreeway.com/SanFranciscoAnotherHoleintheHead,,11/29/2020,12/13/2020,San Francisco,CA,2/29/2020,10/15/2020,,,x,,x,,,,,,,,,,,,,,,,,,,,,,,,
23,,"Irvington, NY 10533",Misc. Niche,Misc. Niche,,Antham Libertarian Film Festival,https://anthemfilmfestival.com/,https://filmfreeway.com/AnthemLibertarianFilmFestival-1536539,Canceled,7/13/2020,7/16/2020,Las Vegas,NV,1/14/2020,4/13/2020,,,,,,,,,,,,,,,,,,,,,,,x,,,,,,
24,,"1616 N 56th Ln Phoenix, AZ 85035 United States","Genre - (SciFi, Fantasy, Thriller, Horror, etc.)","Short, Genre",,Apocalypse Later International Fantastic Film Festival,http://www.alfilmfest.com/,https://filmfreeway.com/ALIFFF,,10/9/2020,10/11/2020,Phoenix,AZ,1/1/2020,8/15/2020,,,,,,,x,,,,,,,,,,x,,,,,,,,,,,,
25,10,"3739 Balboa Street #125 San Francisco, California 94121 United States","Muslim, Arab, Arab Am. (etc)",Muslim/Arab/Arab American,,Arab Film Festival,http://www.arabfilmfestival.org/,https://filmfreeway.com/AFF,,tbd,tbd,San Francisco,CA,tbd,tbd,,,,,,,,,,,,,,,x,,,,,,,,,,,,,,
26,,"13624 Michigan Avenue Dearborn, Michigan 48126 United States","Muslim, Arab, Arab Am. (etc)",Muslim/Arab/Arab American,,Arab Film Festival @ Arab National Museum,http://www.arabamericanmuseum.org/,https://filmfreeway.com/ArabFilmFestivalatAANM,,6/5/2020,6/14/2020,Dearborn,MI,2/2/2020,3/1/2020,,,,,,,,,,,,,,,x,,,,,,,,,,,,,,
969,10,"5300 Wisconsin Avenue Northwest, Washington, District of Columbia 20015 United States","Muslim, Arab, Arab Am. (etc)","Muslim, Arab, Arab Am. (etc)",,Arabian Sights Film Festival,http://filmfestdc.org/arabiansights,https://filmfreeway.com/ArabianSights,,tbd,tbd,"Washington, DC",DC,tbd,tbd,,,,,,,,,,,,,,,x,,,,,,,,,,,,,,
27,,"4147 E Amazon Dr Eugene, OR 97405 United States",Misc. Niche,Misc. Niche,,"Archaeology Channel International Film Festival, The",https://www.archaeologychannel.org/events-guide/tac-international-film-festival/international-film-festival,https://filmfreeway.com/thearchaeologychannelfilmfestival,Switched to online,5/13/2020,5/17/2020,Eugene,OR,11/15/2019,11/15/2019,,,,,,,,,,,,,,,,,,,,,,,x,,,,,,
28,,"Tucson, AZ 85702",General,General,,Arizona International Film Festival,http://www.filmfestivalarizona.com/,https://filmfreeway.com/ArizonaInternationalFilmFestival,New Dates: Oct 1-12,4/15/2020,4/26/2020,Tucson,AZ,1/10/2020,2/20/2020,,,,,x,,,,,,,,,,,,,,,,,,,,,,,,
832,9,"127 E. Congress, Tucson, AZ 85701",Underground,Underground,,Arizona Underground Film Festival,http://www.azundergroundfilmfest.com/,https://filmfreeway.com/ArizonaUndergroundFilmFestival,,tbd,tbd,Tucson ,AZ,tbd,tbd,,,,,,,,,,,,,,,,,,,x,,,,,,,,,,
938,,"817 Central Avenue, Hot Springs, Arkansas 71901 United States",Short,Short,,Arkansas Shorts,http://www.lowkeyarts.org,https://filmfreeway.com/ArkansasShorts,,1/4/2020,1/4/2020,Hot Springs,AR,8/1/2019,11/1/2019,,,,,,,x,,,,,,,,,,,,,,,,,,,,,,
29,11,"21 Kimball Rd #1, Watertown, Massachusetts 02472",General,General,,Arlington International Film Festival,https://www.aiffest.org/,https://filmfreeway.com/arlingtoninternationalfilmfestival,,11/5/2020,11/8/2020,Watertown,MA,2/29/2020,5/30/2020,,,x,,x,,,,,,,,,,,,,,,,,,,,,,,,
833,11,"2919 Maxwell St., 90027 Los Angeles, California",Misc. Niche,Misc. Niche,,Arpa International Film Festival,http://www.arpafilmfestival.com/,https://filmfreeway.com/ArpaFilmFestival,,tbd,tbd,Los Angeles,CA,tbd,tbd,,,,,,,,,,,,,,,,,,,,,,,x,,,,,,
30,,"180 Remsen Street, Brooklyn, New York 11201",General,General,,"Art of Brooklyn Film Festival, The ",https://www.theartofbrooklyn.org/,https://filmfreeway.com/ArtofBrooklynFilmFestival,Switched to virtual; June 1-10,6/1/2020,6/7/2020,Brooklyn,NY,11/1/2019,4/21/2020,,,,,x,,,,,,,,,,,,,,,,,,,,,,,,
31,,"2633 Lincoln Blvd. #254 Santa Monica, CA 90405 United States",Women's,Women's,,Artemis Women in Action Film Festival ,http://www.artemisfilmfestival.com/,https://filmfreeway.com/ArtemisWomenInActionFilmFestival,,4/22/2020,4/25/2020,Santa Monica,CA,6/30/2019,11/30/2019,,,,,,,,x,,,,,,,,,,,,,,,,,,,,,
32,10,"New York, NY 10026",General,General,,"Artists Forum Festival of the Moving Image, The",http://theartistsforum.org/,https://filmfreeway.com/affestnyc,,10/15/2020,10/17/2020,New York,NY,1/15/2020,5/31/2020,,,,,x,,,,,,,,,,,,,,,,,,,,,,,,
33,3,"36 Biltmore Ave, Asheville, NC 28801",Jewish,Jewish,,Asheville Jewish Film Festival,http://ajff.fineartstheatre.com/,---,,tbd,tbd,Asheville,NC,tbd,tbd,,,,,,,,,,x,,,,,,,,,,,,,,,,,,,
34,,"166 E Main St, Ashland, OR 97520",General,General,,Ashland Independent Film Festival,http://www.ashlandfilm.org/,https://filmfreeway.com/ashlandfilm,"Canceled, working on new plan",4/16/2020,4/20/2020,Ashland,OR,10/18/2019,11/29/2019,,,x,,x,,,,,,,,,,,,,,,,,,,,,,,,
35,7,"Made In NY Media Center 30 John Street Brooklyn, NY 11201 United States","Asian, As. Am. (etc)",Asian/Asian American,,Asian American International Film Festival,http://www.asiancinevision.org/,---,,tbd,tbd,Brooklyn,NY,tbd,tbd,,,,,,,,,,,,x,,,,,,,,,,,,,,,,,
964,,"164 North State Street, Chicago, Illinois 60601 United States","Asian, As. Am. (etc)","Asian, As. Am. (etc)",,"Asian American Showcase, The",http://www.faaim.org,https://filmfreeway.com/FAAIM,Canceled/Postponed until further notice,4/3/2020,4/16/2020,Chicago,IL,1/31/2020,2/29/2020,,,,,,,,,,,,x,,,,,,,,,,,,,,,,,
36,,"3630 Harry Hines Boulevard, Dallas, TX 75219 United States","Asian, As. Am. (etc)",Asian/Asian American,,Asian Film Festival of Dallas,http://asianfilmdallas.com/,https://filmfreeway.com/affd,Cancelled,7/16/2020,7/23/2020,Dallas,TX,2/15/2020,3/31/2020,,,,,,,,,,,,x,,,,,,,,,,,,,,,,,
921,,"1049 Ponce De Leon Avenue Northeast, Atlanta, Georgia 30306 United States",Animation,"Animation, Short",,ASIFA-South Animation Conference and Festival,http://www.asifa-south.com,https://filmfreeway.com/asifasouth,All events virtual or online,6/6/2020,6/7/2020,Atlanta,GA,5/1/2019,11/30/2019,,,,,,,x,,,,,,,,,,,,,x,,,,,,,,,
37,9,"110 East Hallam, Suite 103, Aspen, CO  81611",General,General,,Aspen Filmfest,http://www.aspenfilm.org/,---,Switched to hybrid Oct 15-21,9/21/2020,9/26/2020,Aspen,CO,tbd,tbd,,,x,,x,,,,,,,,,,,,,,,,,,,,,,,,
38,,"110 East Hallam, Suite 103, Aspen, CO  81611",Short,Short,,Aspen Shortsfest,http://www.aspenfilm.org/,https://filmfreeway.com/AspenShortsfest,"Canceled, considering virtual",3/31/2020,4/5/2020,Aspen,CO,8/16/2019,11/8/2019,X,X,x,,,,x,,,,,,,,,,,,,,,,,,,,,,
39,,"Barnard College 3009 Broadway New York, NY 10027 United States",Women's,Women's,,Athena Film Festival ,https://athenafilmfestival.com/,https://filmfreeway.com/AthenaFilmFestival,,2/27/2020,3/1/2020,New York,NY,8/1/2019,8/22/2019,,,x,,,,,x,,,,,,,,,,,,,,,,,,,,,
40,,"20 S Court St, Athens, Ohio 45701",General,General,,Athens International Film + Video Festival ,http://athensfilmfest.org/,https://filmfreeway.com/AthensInternationalFilmandVideoFestival,New Dates: Oct 12-18,4/6/2020,4/12/2020,Athens,OH,9/1/2019,12/1/2019,X,,,,x,,,,,,,,,,,,,,,,,,,,,,,,
41,12,"931 Monroe Dr NE, Atlanta, GA 30308 United States",Comedy,Comedy,,Atlanta Comedy Film Festival,https://info.filmfestivalcircuit.com/atlanta-comedy-film-festival,https://filmfreeway.com/AtlantaComedyFilmFestival,New Date: Dec 6,7/31/2020,7/31/2020,Atlanta,GA,12/31/2019,5/31/2020,,,,,,,,,,,,,,,,,,,,,x,,,,,,,,
42,11,"1545 Peachtree Street Northeast, Atlanta, Georgia 30309",Documentary,Documentary,,Atlanta DocuFest,http://www.docufest.com/,https://filmfreeway.com/docufest,,11/5/2020,11/7/2020,Atlanta,GA,12/31/2019,10/7/2020,,,,,,x,,,,,,,,,,,,,,,,,,,,,,,
43,,"25 Park Place NE, Suite 800, Atlanta, GA 30302-5060 United States",General,General,,Atlanta Film Festival,http://atlantafilmfestival.com/,https://filmfreeway.com/ATLFF,Postponed (new dates TBA),4/30/2020,5/10/2020,Atlanta,GA,6/6/2019,11/14/2019,X,X,x,,x,,,,,,,,,,,,,,,,,,,,,,,,
44,,"1180 Briarcliff CT NE Unit 1 Atlanta, GA 30306 United States",Horror,Horror,,Atlanta Horror Film Fest,http://atlantahorrorfilmfest.com/,https://filmfreeway.com/atlantahorrorfest,New Dates: Oct 15-17,9/17/2020,9/19/2020,Atlanta,GA,11/20/2019,8/19/2020,,,,,,,,,,,,,,,,,,x,,,,,,,,,,,
45,,"1800 Peachtree Street NE, Suite 830 Atlanta, GA 30309 United States",Jewish,Jewish,,Atlanta Jewish Film Festival,https://www.ajff.org/,https://filmfreeway.com/AtlJewishFIlm,,2/5/2020,2/25/2020,Atlanta,GA,8/30/2019,10/25/2019,,,x,,,,,,,x,,,,,,,,,,,,,,,,,,,
46,,"1180 Briarcliff CT NE, Atlanta, Georgia 30306",Short,Short,,Atlanta Shortsfest,http://www.atlantashortsfest.com/,https://filmfreeway.com/atlantashortsfest,New Dates: Aug 27-29,7/16/2020,7/18/2020,Atlanta,GA,8/31/2019,6/10/2020,,,,,,,x,,,,,,,,,,,,,,,,,,,,,,
47,,"1180 Briarcliff Ct. Ne #1 Atlanta, Georgia 30306 United States",Underground,Underground,,Atlanta Underground Film Festival,http://www.auff.org/,https://filmfreeway.com/auff,Switched to outdoors Sept 3-5,8/13/2020,8/15/2020,Atlanta,GA,10/31/2019,7/13/2020,,,,,,,,,,,,,,,,,,,x,,,,,,,,,,
805,10,"218 N. Huntington Avenue Margate, NJ 08402 United States",General,General,,Atlantic City Cinefest,http://atlanticcitycinefest.org/,https://filmfreeway.com/DownbeachFilmFestivalAtlanticCityCinefest,,tbd,tbd,Atlantic City,NJ,tbd,tbd,,,,,x,,,,,,,,,,,,,,,,,,,,,,,,
48,,"6226 Middle Fiskville Road, Austin, Texas 78752","Asian, As. Am. (etc)",Asian/Asian American,,Austin Asian American Film Festival,https://www.aaafilmfest.org/,https://filmfreeway.com/AAAFF,Postponed until late November; virtual shorts program June 11-17,6/11/2020,6/14/2020,Austin,TX,11/15/2019,2/28/2020,,,,,,,,,,,,x,,,,,,,,,,,,,,,,,
49,,"8600 FM 620 N Austin, TX 78726 United States",Comedy,"Short, Comedy",,Austin Comedy Short Film Festival,https://info.filmfestivalcircuit.com/austin-comedy-short-film-festival,https://filmfreeway.com/AustinComedyShortFilmFestival,New Date: Sept 13,4/19/2020,4/19/2020,Austin,TX,9/30/2019,2/29/2020,,,,,,,x,,,,,,,,,,,,,,x,,,,,,,,
50,10,"1801 Salina St. Austin, Texas 78702 United States",General,General,,Austin Film Festival ,https://austin...festival.com/,https://filmfreeway.com/AustinFilmFestival,,10/22/2020,10/29/2020,Austin,TX,3/27/2020,7/6/2020,X,X,,,x,,,,,,,,,,,,,,,,,,,,,,,,
52,11,"Dell Jewish Community Campus, 7300 Hart Ln, Austin, TX 78731",Jewish,Jewish,,Austin Jewish Film Festival,https://austinjff.org/,---,,tbd,tbd,Austin,TX,tbd,tbd,,,,,,,,,,x,,,,,,,,,,,,,,,,,,,
53,,"1911 Aldrich Street, Austin, Texas 78723",General,General,,Austin Revolution Film Festival,https://www.austinrevolution.com/,https://filmfreeway.com/austinrevolutionfilmfest,"Postponed until March 25-27, 2021",9/9/2020,9/12/2020,Austin,TX,10/31/2019,6/20/2020,,,x,,x,,,,,,,,,,,,,,,,,,,,,,,,
54,,"3503 W. Pico Blvd Los Angeles, California 90019 United States","Social Justice, Peace",Social Justice/Peace,,Awareness Festival,https://awarenessfestival.org/,https://filmfreeway.com/AwarenessFestival,Switched to virtual ,10/1/2020,10/11/2020,Los Angeles,CA,1/7/2020,8/5/2020,,,,,,,,,,,,,,,,,,,,,,,,,x,,,,
869,,"6404 Hillcrest Park Ct Mobile, AL 36695 United States",General,General,,Azalea Film Festival,http://www.azaleafilmfestival.com,https://filmfreeway.com/AzaleaFilmFestival,Postponed (working on summer dates),4/3/2020,4/4/2020,Mobile,AL,6/15/2019,1/15/2020,,,,,x,,,,,,,,,,,,,,,,,,,,,,,,
55,,"202 East Pratt Street, Baltimore, Maryland 21202","Genre - (SciFi, Fantasy, Thriller, Horror, etc.)","Short, Genre",,Balticon Short Film Festival,https://www.balticon.org/wp53/,https://filmfreeway.com/BalticonShortFilmFestival,"Canceled, but presenting free virtual events May 22-24",5/24/2020,5/24/2020,Baltimore,MD,2/28/2020,3/31/2020,,,,,,,x,,,,,,,,,,x,,,,,,,,,,,,
56,,"1711 North Charles Street, Baltimore, Maryland 21201","Black, African, Afr. Am. (etc)",Black/African/African American,,Baltimore International Black Film Festival,http://www.bibff.com/,https://filmfreeway.com/BaltimoreInternationalBlackFilmFestival,,10/7/2020,10/12/2020,Baltimore,MD,12/15/2019,9/6/2020,,,,,,,,,,,x,,,,,,,,,,,,,,,,,,
770,7,"30 Lafayette Ave, Brooklyn, NY 11217",General,General,,Bam Cinemafest,https://www.bam.org,---,Canceled,tbd,tbd,Brooklyn,NY,tbd,tbd,,,,,x,,,,,,,,,,,,,,,,,,,,,,,,
766,,"525 W. Okmulgee Ave Muskogee, OK 74401",General,General,,Bare Bones International Film & Music Festival,http://www.barebonesfilmfestival.org/,https://filmfreeway.com/BareBonesFilmFestival,Postponed until further notice,4/21/2020,4/26/2020,Muskogee,OK,7/31/2019,12/31/2019,,,,,x,,,,,,,,,,,,,,,,,,,,,,,,
57,,"100 Lafayette St., 70801 Baton Rouge, Louisiana",Jewish,Jewish,,Baton Rouge Jewish Film Festival,https://brjff.com/,---,,1/15/2020,1/20/2020,Baton Rouge,LA,---,---,,,,,,,,,,x,,,,,,,,,,,,,,,,,,,
58,,"6114 La Salle Ave. #648 Oakland, CA 94611",Children's,Children's,,Bay Area International Childrens Film Festival,http://baicff.com/,https://filmfreeway.com/BAICFF,,2/15/2020,2/16/2020,Oakland,CA,8/31/2019,9/30/2019,,,,,,,,,,,,,,,,,,,,,,,,,,x,,,
59,,"Beaufort, SC 29901",General,General,,Beaufort International Film Festival,https://www.beaufortfilmfestival.com/,https://filmfreeway.com/BeaufortInternationalFilmFestival,,2/18/2020,2/23/2020,Beaufort,SC,5/31/2019,10/31/2019,,,,,x,,,,,,,,,,,,,,,,,,,,,,,,
910,,"114 W. Magnolia St., Bellingham, Washington 98225 United States",Documentary,"Social Justice/Peace, Documentary",,Bellingham Human Rights Film Festival,https://bhrff.webs.com,https://filmfreeway.com/BellinghamHumanRightsFilm,,2/20/2020,2/29/2020,Bellingham,WA,10/15/2019,10/15/2019,,,,,,x,,,,,,,,,,,,,,,,,,,x,,,,
60,,"444 E. Grand Ave. Suite 100 Beloit, WI 53511",General,General,,Beloit International Film Festival,https://beloitfilmfest.org/,https://filmfreeway.com/BeloitInternationalFilmFestival,,2/21/2020,3/1/2020,Beloit,WI,5/31/2019,10/31/2019,,,,,x,,,,,,,,,,,,,,,,,,,,,,,,
61,,"1000 NW Wall Street Suite 240 Bend, Oregon 97703 United States",General,General,,BendFilm Festival,http://www.bendfilm.org/,https://filmfreeway.com/BendFilm,Switched to virtual & drive-in Oct 8-25,10/8/2020,10/11/2020,Bend,OR,2/12/2020,6/10/2020,,,x,,x,,,,,,,,,,,,,,,,,,,,,,,,
822,10,"1017 L Street #379, Sacramento CA 95814",LGBTQ+,LGBTQ+,,BENT: Sacramento LGBTQ Film Festival,https://bentfilmfest.org/,https://bentfilmfest.org/submityourfilm/,,tbd,tbd,Sacramento,CA,tbd,tbd,,,,,,,,,x,,,,,,,,,,,,,,,,,,,,
62,,"640 B Street Bentonville, AR 72712 United States",General,General,,Bentonville Film Festival,http://bentonv...festival.com/,https://filmfreeway.com/BentonvilleFilmFestival,New Dates: Aug 5-8,4/29/2020,5/2/2020,Bentonville,AR,10/10/2019,1/15/2020,,,,,x,,,,,,,,,,,,,,,,,,,,,,,,
63,10,"1939 Addison St, Berkeley, CA 94704",General,General,,Berkeley Video Film Festival,http://www.berkeleyvideofilmfest.org/,---,,tbd,tbd,Berkeley,CA,7/25/2020,7/25/2020,,,,,x,,,,,,,,,,,,,,,,,,,,,,,,
64,,"Great Barrington, MA 01230",General,General,,Berkshire International Film Festival,https://www.biffma.org/,https://filmfreeway.com/berkshireinternationalfilmfestival,New Dates: Sept 10-13,5/28/2020,5/31/2020,Great Barrington,MA,12/31/2019,3/20/2020,,,,,x,,,,,,,,,,,,,,,,,,,,,,,,
806,,"588 Sutter Street Suite 325 San Francisco, California 94102",Misc. Niche,Misc. Niche,,Best Actors Film Festival,http://www.actorsfestival.com/,https://filmfreeway.com/BestActorsFilmFestival,,10/16/2020,10/17/2020,San Francisco,CA,12/31/2019,8/15/2020,,,,,,,,,,,,,,,,,,,,,,,x,,,,,,
65,,"7700 Old Georgetown Road Lobby Level Bethesda, MD 20814",Documentary,"Short, Documentary",,Bethesda Film Festival,https://www.bethesda.org/bethesda/bethesda-film-fest,https://filmfreeway.com/BethesdaFilmFest,Postponed ,3/27/2020,3/28/2020,Bethesda,MD,1/3/2020,1/3/2020,,,,,,x,x,,,,,,,,,,,,,,,,,,,,,,
