534,,"2522 SE Clinton St, Portland, OR 97202",Underground,Underground,,Portland Underground Film Festival,https://puffpdx.org/,https://puffpdx.org/submit,,1/17/2020,1/19/2020,Portland,OR,8/31/2019,8/31/2019,,,,,,,,,,,,,,,,,,,x,,,,,,,,,,
535,10,"8371 N Interstate Ave, Portland, OR 97217",Underground,Underground,,Portland Unknown Film Festival,http://www.portlandunknown.com/,https://filmfreeway.com/PortlandUnknownFilmFestival,,10/16/2020,10/18/2020,Portland,OR,1/1/2020,7/8/2020,,,,,,,,,,,,,,,,,,,x,,,,,,,,,,
536,,"305 Harrison Street Seattle, WA 98109",General,General,,Post Alley Film Festival,http://www.postalleyfilmfestival.com/,https://filmfreeway.com/PostAlleyFilmFestival,New Date: Nov 7,3/28/2020,3/28/2020,Seattle,WA,8/30/2019,12/13/2019,,,,,,,x,x,,,,,,,,,,,,,,,,,,,,,
537,6,"1100 East Sheldon Street, Prescott, Arizona 86301",General,General,,Prescott Film Festival ,http://prescottfilmfestival.com/,https://filmfreeway.com/PrescottFilmFestival,Canceled,6/5/2020,6/13/2020,Prescott,AZ,2/9/2020,4/12/2020,,,,,x,,,,,,,,,,,,,,,,,,,,,,,,
872,,"65 Witherspoon Street, Princeton, NJ 08542","Environment, Outdoor, Adventure, Wildlife",Environment/Outdoor/Adventure/Wildlife,,Princeton Environmental Film Festival,https://princetonlibrary.org/peff/,https://princetonlibrary.org/peff/entry/,Postponed (planning on fall dates TBD),4/13/2020,4/19/2020,Princeton,NJ,1/15/2020,1/15/2020,,,,,,,,,,,,,,,,,,,,,,,,x,,,,,
942,,"160 Nassau Street, Princeton, New Jersey 08542 United States",Short,Short,,Princeton Independent Film Festival,https://www.prindiefest.com,https://filmfreeway.com/prindie,Switched to virtual Sept 10-13,9/18/2020,9/20/2020,Princeton,NJ,6/1/2020,6/1/2020,,,x,,,,x,,,,,,,,,,,,,,,,,,,,,,
538,,"1005 Main St. Hope Artiste Village - #1211 Pawtucket, RI 02860 United States",Children's,Children's,,Providence Children's Film Festival,http://providencechildrensfilmfestival.org/,https://filmfreeway.com/ProvidenceChildrensFilmFestival,,2/14/2020,2/25/2020,Providence,RI,9/30/2019,11/23/2019,,,x,,,,,,,,,,,,,,,,,,,,,,,x,,,
539,9,"Providence, Rhode Island 02903","Latino, Latin American (etc)",Latino/Latin American,,Providence Latin American Film Festival,http://www.plaff.org/,https://filmfreeway.com/PLAFF,Switched to virtual Sept 25 - Oct 3,9/25/2020,10/3/2020,Providence,RI,3/1/2020,4/1/2020,,,,,,,,,,,,,x,,,,,,,,,,,,,,,,
540,,"237 Commercial Street, Provincetown, Massachusetts 02657",General,General,,Provincetown Film Festival,http://www.ptownfilmfest.org/,https://filmfreeway.com/ProvincetownFilmFestival,New Dates: July 16-19 (Drive-in & online),6/17/2020,6/21/2020,Provincetown,MA,12/6/2019,3/2/2020,,,x,,x,,,,,,,,,,,,,,,,,,,,,,,,
854,10,"20 6th Street Bristol, TN 37620 United States",General,General,,PUSH! Film Festival,http://www.pushfilmfest.com/,https://filmfreeway.com/PUSHFilmFest,,tbd,tbd,Bristol,TN,tbd,tbd,,,,,x,,,,,,,,,,,,,,,,,,,,,,,,
951,7,"1001 Bissonnet Street, Houston, Texas 77005 United States",LGBTQ+,LGBTQ+,,Qfest: The Houston International LGBTQ Film Festival,http://www.q-fest.com,https://filmfreeway.com/QFestHouston,,tbd,tbd,Houston,TX,tbd,tbd,,,,,,,,,x,,,,,,,,,,,,,,,,,,,,
541,,"1315 Walnut Street Suite 1132 Philadelphia, PA 19107 United States",LGBTQ+,LGBTQ+,,qFLIX Philadelphia,http://www.qflixphilly.com/,https://filmfreeway.com/qFLIXphiladelphia2019,New Dates: July 12-19,3/22/2020,3/29/2020,Philadelphia,PA,---,---,,,,,,,,,x,,,,,,,,,,,,,,,,,,,,
855,10,"101 Decatur St. Cumberland, MD 21502 United States",General,General,,Queen City Film Festival,http://www.alleganyalliedarts.org/qcff/,https://filmfreeway.com/QueenCityFilmFestival,"Postponed until April 1-4, 2021",10/1/2020,10/4/2020,Cumberland,MD,4/30/2020,7/31/2020,,,,,x,,,,,,,,,,,,,,,,,,,,,,,,
542,,"74-15 35th Ave. #6F Jackson Heights, NY 11372 United States",General,General,,Queens World Film Festival,https://www.queensworldfilmfestival.com/,https://filmfreeway.com/QueensWorldFilmFestival,Postponed,3/19/2020,3/29/2020,New York,NY,7/8/2019,11/11/2019,,,,,x,,,,,,,,,,,,,,,,,,,,,,,,
543,,"Ashford, WA 98304",General,General,,Rainier Independent Film Festival,http://rainier.film/,https://filmfreeway.com/RainierIndependentFilmFestival,Canceled; Announced hiatus for 2020,5/15/2020,5/17/2020,Rainier,WA,11/14/2019,3/14/2020,,,,,x,,,,,,,,,,,,,,,,,,,,,,,,
544,,"201 East Hargett Street, Raleigh, North Carolina 27601",General,General,,Raleigh Film & Art Festival,https://www.raleighfilmandartfestival.com/,https://filmfreeway.com/RaleighFilmandArtFestival,Switched to virtual,10/2/2020,10/4/2020,Raleigh,NC,12/1/2019,7/1/2020,,,,,x,,,,,,,,,,,,,,,,,,,,,,,,
545,,"202 S. Railroad Ave. Kings Mountain, NC 28150 United States",General,General,,Real to Reel International Film Festival,http://www.ccartscouncil.org/realtoreel/,https://filmfreeway.com/RealtoReelInternationalFilmFestival,New Dates: Sep 9-12,7/22/2020,7/25/2020,Kings Mountain,NC,2/7/2020,5/1/2020,,,,,x,,,,,,,,,,,,,,,,,,,,,,,,
546,,"1425 Lincoln Highway, DeKalb, Illinois 60115",Student,"Short, Student",,Reality Bytes Independent Student Film Festival,http://realitybytes.niu.edu/,https://filmfreeway.com/RealityBytesIndependentStudentFilmFestival,Postponed until fall,4/14/2020,4/16/2020,Dekalb,IL,2/23/2020,3/14/2020,,,,,,,x,,,,,,,,,,,,,,,x,,,,,,,
547,,"315 North Husband Street, Stillwater, Oklahoma 74075",General,General,,Red Dirt Film Festival,http://www.reddirtfilm.com/,https://filmfreeway.com/RedDirtFilmFestival,,3/6/2020,3/8/2020,Stillwater,OK,8/16/2019,11/27/2019,,,,,x,,,,,,,,,,,,,,,,,,,,,,,,
548,11,"501 N Main St, Los Angeles, CA 90012","Native American, Indigenous (etc)",Native American/Indigenous,,Red Nation International Film Festival,https://www.rednationff.com/,---,,11/1/2020,11/15/2020,Los Angeles,CA,8/31/2020,8/31/2020,,,,,,,,,,,,,,x,,,,,,,,,,,,,,,
549,11,"755 S. Main #4-165 Festival City, UT 84720 United States",General,General,,Red Rock Film Festival - Utah,http://www.redrockfilmfestival.com/,https://filmfreeway.com/RedRockFilmFestival,,11/4/2020,11/7/2020,Festival City,UT,3/14/2020,9/10/2020,,,,,x,,,,,,,,,,,,,,,,,,,,,,,,
550,,"4180 HWY 6 SOUTH COLLEGE STATION, TX 77845",General,General,,Red Wasp Film Festival,http://www.acbv.org/events/2019/red-wasp-film-festival-2019,https://filmfreeway.com/RedWaspFilmFestival,,5/2/2020,5/3/2020,College Station,TX,1/20/2020,3/1/2020,,,,,x,,,,,,,,,,,,,,,,,,,,,,,,
778,10,"2000 14th Street NW, Suite 105 Washington, DC 20009 United States",LGBTQ+,LGBTQ+,,Reel Affirmations: Washington DC's International LGBTQ Film Festival,http://thedccenter.org/reelaffirmations,https://filmfreeway.com/ReelAffirmations,Switched to online,10/15/2020,10/18/2020,Washington ,DC,1/31/2020,4/30/2020,,,,,,,,,x,,,,,,,,,,,,,,,,,,,,
551,4,"45 Pershing Ave Poughkeepsie, NY 12601 United States",Student,"Short, Student",,Reel Expressions Teen Film festival,https://feelthearteffect.org/events/reel-expressions/,https://feelthearteffect.org/events/reel-expressions/,,tbd,tbd,Poughkeepsie,NY,tbd,tbd,,,,,,,x,,,,,,,,,,,,,,,x,,,,,,,
552,11,"4710 Auth Place Suite 510 camp springs, MD 20746 United States",General,General,,Reel Independent Film Extravaganza,https://www.reelindependentfilm.com/,https://filmfreeway.com/ReelIndependentFilmExtravaganza,,tbd,tbd,Camp Springs,MD,tbd,tbd,,,,,x,,,,,,,,,,,,,,,,,,,,,,,,
553,,"299 Alhambra Circle Suite 224 Miami, FL 33134 United States",Short,"Short, Misc. Niche",,Reel Minds: Miami Mental Health Film Festival,https://namimiami.org/,https://filmfreeway.com/MiamiMentalHealthFilmFestival,Postponed,5/17/2020,5/17/2020,Miami,FL,2/14/2020,2/14/2020,,,,,,,x,,,,,,,,,,,,,,,,x,,,,,,
554,,"1824 Statesville Avenue, Charlotte, North Carolina 28206",LGBTQ+,LGBTQ+,,Reel Out Charlotte Film Festival,https://charlottepride.org/reelout,https://filmfreeway.com/ReelOutCharlotte,New Dates: Oct 24-Nov 1,5/9/2020,5/17/2020,Charlotte,NC,3/13/2020,3/13/2020,,,,,,,,,x,,,,,,,,,,,,,,,,,,,,
953,9,"809 E Olive Ave, Fresno, CA 93728",LGBTQ+,LGBTQ+,,Reel Pride LGBT Film Festival,https://www.reelpride.com,https://filmfreeway.com/ReelPrideLGBTFilmFestival,,tbd,tbd,Fresno,CA,tbd,tbd,,,,,,,,,x,,,,,,,,,,,,,,,,,,,,
555,11,"5240 Lankershim Boulevard, Los Angeles, California 91601",Misc. Niche,Misc. Niche,,Reel Recovery Film Festival & Symposium,http://reelrecoveryfilmfestival.org/,https://filmfreeway.com/REELRecoveryFilmFestival-16881,,10/16/2020,10/22/2020,Los Angeles,CA,8/21/2020,8/21/2020,,,,,,,,,,,,,,,,,,,,,,,x,,,,,,
556,,"270 West 96th Street New York, NY 10025",Women's,"Women's, Misc. Ethnic/Cultural/Foreign Focus",,Reel Sisters of the Diaspora Film Festival & Lecture Series,http://reelsisters.com/,https://filmfreeway.com/ReelSistersoftheDiasporaFilmFestival,,10/24/2020,10/25/2020,New York,NY,3/9/2020,6/15/2020,X,,, ,,,,x,,,,,,,,x,,,,,,,,,,,,,
557,,"2345 NE Lake Breeze Ln Lees Summit, MO 64086 United States",Student,Student,,Reel Spirit Young Filmmakers,https://kcfilmfest.org/reel-spirit/competition/,https://filmfreeway.com/ReelSpiritYoungFilmmakers,Swtiched to online,4/18/2020,4/18/2020,Lee's Summit,MO,2/19/2020,2/19/2020,,,,,,,,,,,,,,,,,,,,,,x,,,,,,,
998,,"1124 Pacific Avenue, Santa Cruz, CA 95060 United States",Misc. Niche,Misc. Niche,,Reel Work labor Film Festival,http://reelwork.org,https://filmfreeway.com/ReelWorkLaborFilmFestival,Live events postponed; some virtual programming being planned,4/24/2020,5/3/2020,Santa Cruz,CA,1/2/2020,3/1/2020,,,,,,,,,,,,,,,,,,,,,,,x,,,,,,
883,10,"1789 S. Braddock Avenue, Suite 565, Pittsburgh, PA 15218",Misc. Niche,Misc. Niche,,ReelAbilities Pittsburgh,https://filmpittsburgh.org/pages/reelabilities,---,,tbd,tbd,Pittsburgh,PA,tbd,tbd,,,x,,,,,,,,,,,,,,,,,,,,x,,,,,,
558,9,"5720 N. Ridge Ave. Chicago, IL 60660 United States",LGBTQ+,LGBTQ+,,Reeling: The Chicago LGBTQ+ International Film Festival,https://reelingfilmfestival.org/,https://filmfreeway.com/ReelingFilmFestival,Switched to virtual ,9/24/2020,10/4/2020,Chicago,IL,3/26/2020,6/4/2020,,,,,,,,,x,,,,,,,,,,,,,,,,,,,,
559,10,"107 Truitt Avenue, Rehoboth Beach, DE 19971",General,General,,Rehoboth Beach Independent Film Festival,https://www.rehobothfilm.com/festival/,https://filmfreeway.com/TheRehobothBeachIndependentFilmFestival,,tbd,tbd,Rehoboth Beach,DE,tbd,tbd,,,,,x,,,,,,,,,,,,,,,,,,,,,,,,
560,9,"New York, New York 10013",General,General,,Revolution Me Film Festival,https://www.revolutionmefilms.com/,https://filmfreeway.com/RevolutionMeFilmFestival,,9/25/2020,9/27/2020,New York,NY,3/8/2020,6/21/2020,,,,,x,,,,,,,,,,,,,,,,,,,,,,,,
562,,"109 W. 15th Street Richmond, virginia 23224 United States",Dance,Dance,,Richmond Dance Festival,https://www.dogtowndancetheatre.com/,https://filmfreeway.com/RichmondDanceFestival,,4/24/2020,5/9/2020,Richmond,VA,1/31/2020,1/31/2020,,,,,,,,,,,,,,,,,,,,,,,,,,,x,,
563,,"3126 W. Cary Street #605 Richmond, VA 23221 United States",General,General,,Richmond International Film Festival,https://www.rvafilmfestival.com/,https://filmfreeway.com/RICHMONDINTERNATIONALFILMFESTIVAL,Postponed (until summer or fall),4/21/2020,4/26/2020,Richmond,VA,6/20/2019,11/14/2019,,,,,x,,,,,,,,,,,,,,,,,,,,,,,,
893,10,"80 East Ridge Road, Ridgefield, Connecticut 06877 United States",General,General,,Ridgefield Independent Film Festival,https://www.riffct.org,https://filmfreeway.com/RidgefieldIndependentFilmFestival,Switched to hybrid (live and virtual screenings),10/15/2020,10/18/2020,Ridgefield,CT,4/3/2020,7/20/2020,,,x,,x,,,,,,,,,,,,,,,,,,,,,,,,
564,4,"41 N. Broad Street Ridgewood, NJ 07450 United States",General,General,,"Ridgewood Guild International Film Festival, The ",https://ridgewoodguildfilmfest.com/,https://filmfreeway.com/RidgewoodInternationalFilmFestival,New Dates: Oct 7-8,4/29/2020,4/30/2020,Ridgewood,NJ,1/24/2020,4/10/2020,,,,,x,,,,,,,,,,,,,,,,,,,,,,,,
565,,"234 S. Main Street Suite 5 Goshen, Indiana 46526 United States",General,General,,River Bend Film Festival,https://www.riverbendfilmfest.com/,https://filmfreeway.com/RiverBendFilmFestival,New Dates: Oct 1-3,4/30/2020,5/2/2020,Goshen,IN,8/31/2019,12/20/2019,,,,,x,,,,,,,,,,,,,,,,,,,,,,,,
903,,"112 Maiden Alley, Paducah, Kentucky 42001 United States",General,General,,River's Edge International Film Festival ,http://www.riversedgefilmfestival.com,https://filmfreeway.com/RiversEdgeInternationalFilmFestival,New Dates: Nov 12-15,8/13/2020,8/16/2020,Paducah,KY,1/31/2020,4/30/2020,,,,,x,,,,,,,,,,,,,,,,,,,,,,,,
567,,"305 West Fourth Street Suite 1A Winston-Salem, NC 27101 United States",General,General,,RiverRun International Film Festival,https://riverrunfilm.com/,https://filmfreeway.com/RiverRun,"Canceled, hope to schedule mini fests later in year",3/26/2020,4/5/2020,Winston-Salem,NC,9/1/2019,12/1/2019,X,X,x,,x,,,,,,,,,,,,,,,,,,,,,,,,
568,,"Riverside, California 92506 United States",General,General,,Riverside International Film Festival,https://www.riversidefilmfestival.org/,https://filmfreeway.com/RiversideInternationalFilmFestival,,4/11/2020,4/11/2020,Riverside,CA,12/3/2019,2/15/2020,,,,,x,,,,,,,,,,,,,,,,,,,,,,,,
569,4,"274 Goodman St. North, Ste. D103 Rochester, NY 14607",Children's,"Short, Children's",,Rochester International Children's Film Festival,https://www.kidsfestroc.org/,https://filmfreeway.com/kidsfestroc,,tbd,tbd,Rochester,NY,tbd,tbd,,,,,,,x,,,,,,,,,,,,,,,,,,,x,,,
570,,"900 East Avenue, Rochester, New York 14607",General,General,,Rochester International Film Festival,http://rochesterfilmfest.org/,https://filmfreeway.com/RochesterInternationalFilmFestival,Switched to virtual; June 21-27,6/11/2020,6/13/2020,Rochester,NY,12/1/2019,2/1/2020,,,,,x,,,,,,,,,,,,,,,,,,,,,,,,
571,,"450 West Nyack Rd, West Nyack, NY 10994",Jewish,Jewish,,Rockland Jewish Film Festival,https://jccrockland.org/film-festival/,---,Postponed until July,3/29/2020,4/30/2020,West Nyack,NY,---,---,,,,,,,,,,x,,,,,,,,,,,,,,,,,,,
572,,"14 Spring Valley Commons Spring Valley, NY 10977 United States",Student,Student,,Rockland Youth Film Festival,http://www.ryff.org/,https://filmfreeway.com/RocklandYouthFilmFestival,Canceled,6/6/2020,6/7/2020,Spring Valley,NY,11/1/2019,11/1/2019,,,,,,,,,,,,,,,,,,,,,,x,,,,,,,
856,11,"106 S. Austin Street Rockport, Texas 78382 United States",General,General,,Rockport Film Festival,http://rockportfilmfestival.com/,https://filmfreeway.com/RockportFilmFestival,,tbd,tbd,Rockport,TX,tbd,tbd,,,,,x,,,,,,,,,,,,,,,,,,,,,,,,
573,11,"2727 N Cascade, Colorado Springs, CO 80907",Documentary,"Women's, Documentary",,Rocky Mountain Women's Film Festival ,https://rmwfilminstitute.org/festival,---,,11/13/2020,11/15/2020,Colorado Springs,CO,3/15/2020,6/30/2020,,,x,,,x,,x,,,,,,,,,,,,,,,,,,,,,
988,6,"Los Angeles, CA",Misc. Niche,Misc. Niche,,RomCom Fest,https://www.romcomfest.com,https://www.romcomfest.com/,Postponed until 2021,6/25/2020,6/28/2020,Los Angeles,CA,1/10/2020,4/20/2020,,,x,,,,,,,,,,,,,,,,,,,,x,,,,,,
575,11,"3 Central Plaza, # 367 Rome, GA 30161",General,General,,Rome International Film Festival,http://www.riffga.com/,https://filmfreeway.com/RIFF,,11/12/2020,11/15/2020,Rome,GA,3/15/2020,8/15/2020,,,x,,x,,,,,,,,,,,,,,,,,,,,,,,,
576,,"232 Third St Suite E-106 Brooklyn, NY 11215 United States",General,General,,Rooftop Films Summer Series,https://www.rooftopfilms.com/,https://filmfreeway.com/RooftopFilms,,5/15/2020,8/21/2020,New York,NY,11/29/2019,2/14/2020,,,,,x,,,,,,,,,,,,,,,,,,,,,,,,
577,,"4501 North Main Street, Roswell, New Mexico 88201","Genre - (SciFi, Fantasy, Thriller, Horror, etc.)",Genre,,Roswell Sci-Fi Film Festival,http://www.roswellfilmcon.com/,https://filmfreeway.com/RoswellScififilmfestival,Switched to online: July 3-5,7/3/2020,7/5/2020,Roswell,NM,11/30/2019,2/29/2020,,,,,,,,,,,,,,,,,x,,,,,,,,,,,,
857,,"411 E. Monroe Springfield, IL 62705",General,General,,Route 66 Film Festival,http://route66filmfestival.net,https://filmfreeway.com/Route66FilmFestival,,11/22/2020,11/23/2020,Springfield,IL,4/1/2019,8/22/2019,,,,,x,,,,,,,,,,,,,,,,,,,,,,,,
578,,"465 Huntington Avenue, Boston, Massachusetts 02115","Misc. Ethnic, Cultural, Foreign Focus (etc)",Misc. Ethnic/Cultural/Foreign Focus,,"Roxbury International Film Festival, The ",https://www.roxburyinternationalfilmfestival.com/,https://filmfreeway.com/TheRoxburyInternationalFilmFestival,New Dates: Sept 30-Oct 4,6/17/2020,6/27/2020,Boston,MA,1/27/2020,3/9/2020,,,x,,,,,,,,,,,,,x,,,,,,,,,,,,,
579,,"200 N. Main Street Royal Oak, MI 48067 United States",General,General,,Royal Starr Film Festival,https://www.royalstarr.org/,https://filmfreeway.com/RoyalStarrFilmFestival,Switched to drive-in & streaming,9/4/2020,9/13/2020,Royal Oak,MI,12/31/2019,5/31/2020,,,x,,x,,,,,,,,,,,,,,,,,,,,,,,,
580,,"100 Edgartown Rd., Vineyard Havens, MA 02568","Black, African, Afr. Am. (etc)",Black/African/African American,,"RSF Martha's Vinyard African American Film Festival, The",http://www.mvaaff.com/,https://filmfreeway.com/mvaaff,Switched to online Oct 6-10,8/7/2020,8/15/2020,Vinyard Havens,MA,5/19/2020,5/19/2020,,,,,,,,,,,x,,,,,,,,,,,,,,,,,,
758,,"1800 Lakeside Ave, Richmond, Virginia 23228","Environment, Outdoor, Adventure, Wildlife",Environmental/Outdoor/Adventure/Wildlife,,RVA Environmental Film Festival,https://rvaeff.org/,https://filmfreeway.com/RVAEnvironmentalFilmFestival,,2/9/2020,2/9/2020,Richmond,VA,10/1/2019,12/31/2019,,,, ,,,,,,,,,,,,,,,,,,,,x,,,,,
581,11,"Concord, NH 03302",General,General,,S.N.O.B.(Somewhat North of Boston) Film Festival,https://www.snobfilmfestival.com/,https://filmfreeway.com/SNOBFilmFestival,,tbd,tbd,Concord,NH,tbd,tbd,,,,,x,,,,,,,,,,,,,,,,,,,,,,,,
582,9,"10423 Ambassador Dr. Rancho Cordova, CA 95670 United States",General,General,,Sacramento Film and Music Festival,http://www.sacfilm.com/,https://filmfreeway.com/SacramentoFilmandMusicFestival,,tbd,tbd,Sacramento,CA,tbd,tbd,,,,,x,,,,,,,,,,,,,,,,,,,,,,,,
887,9,"1211 K Street, Sacramento, California 95814 United States",General,General,,Sacramento Film and Music Festival,http://www.sacfilm.com,https://filmfreeway.com/SacramentoFilmandMusicFestival,,tbd,tbd,Sacramento,CA,tbd,tbd,,,,,x,,,,,,,,,,,,,,,,,,,,,,,,
583,,"3522 Stockton Boulevard, Sacramento, California 95820",Horror,Horror,,Sacramento Horror Film Festival,https://www.sachorrorfilmfest.com/,https://filmfreeway.com/SacramentoHorrorFilmFestival,,9/19/2020,9/19/2020,Sacramento,CA,9/30/2019,8/31/2020,,,,,,,,,,,,,,,,,,x,,,,,,,,,,,
584,,"1500 West El Camino Ave #362 Sacramento, California 95833-1945 United States",General,General,,Sacramento International Film Festival,https://www.sacramentofilmfestival.com/,https://filmfreeway.com/SacramentoInternationalFilmFestival,,4/25/2020,5/3/2020,Sacramento,CA,5/21/2019,2/1/2020,,,,,x,,,,,,,,,,,,,,,,,,,,,,,,
882,,"35 Congress Street, Salem, MA 01970",Documentary,Documentary,,Salem Film Fest,https://salemfilmfest.com/2019/,---,Postponed Indefinitely,3/20/2020,3/29/2020,Salem,MA,tbd,tbd,,,,,,x,,,,,,,,,,,,,,,,,,,,,,,
933,8,"1763 North Gower Street, Los Angeles, California 90028 United States",Short,Short,,Salute Your Shorts,http://saluteyourshortsfest.com,https://filmfreeway.com/SaluteYourShortsFest,Switched to drive-in & virtual Aug 21 - Sept 5,8/21/2020,8/23/2020,Los Angeles,CA,1/26/2020,6/21/2020,,,x,,,,x,,,,,,,,,,,,,,,,,,,,,,
585,7,"723 S. Brazos Street San Antonio, Texas 78207 United States",General,General,,San Antonio Cinefestival,http://www.guadalupeculturalarts.org/cinefestival/,https://filmfreeway.com/SanAntonioCineFestival,,tbd,tbd,San Antonio,TX,tbd,tbd,,,,,x,,,,,,,,,,,,,,,,,,,,,,,,
586,,"8452 Fredericksburg Rd PMB #264 San Antonio, TX 78229 United States",General,General,,San Antonio Film Festival,http://safilm.com/,https://filmfreeway.com/SAFILM,New Dates: Aug 4-9,7/28/2020,8/2/2020,San Antonio,TX,11/8/2019,4/17/2020,,,,,x,,,,,,,,,,,,,,,,,,,,,,,,
858,10,"2623 SE Military Dr, San Antonio, TX 78223",LGBTQ+,LGBTQ+,,San Antonio QFest,http://www.pridesanantonio.org/qfest-film-festival.html,https://filmfreeway.com/SanAntonioQFest,,tbd,tbd,San Antonio,TX,tbd,tbd,,,,,,,,,x,,,,,,,,,,,,,,,,,,,,
587,,"2467 Marilouise Way San Diego, CA 92103 United States","Muslim, Arab, Arab Am. (etc)",Muslim/Arab/Arab American,,San Diego Arab Film Festival,http://sandiegoaff.org/,https://filmfreeway.com/SanDiegoArabFilmFestival,New Dates: June 19-28,3/27/2020,4/4/2020,San Diego,CA,9/15/2019,10/15/2019,,,,,,,,,,,,,,,x,,,,,,,,,,,,,,
797,11,"2508 Historic Decatur Road, San Diego, CA 92106","Asian, As. Am. (etc)",Asian/Asian American,,San Diego Asian Film Festival,https://sdaff.org,https://filmfreeway.com/SanDiegoAsianFilmFestival,,11/7/2020,11/7/2020,San Diego,CA,3/30/2020,6/25/2020,,,,,,,,,,,,x,,,,,,,,,,,,,,,,,
588,,"220 West G. Street, San Diego, CA 92101","Black, African, Afr. Am. (etc)",Black/African/African American,,San Diego Black Film Festival,http://www.sdbff.com/,https://filmfreeway.com/SANDIEGOBLACKFILMFESTIVAL,,1/29/2020,2/2/2020,San Diego,CA,10/14/2019,12/20/2019,,,,,,,,,,,x,,,,,,,,,,,,,,,,,,
589,10,"2683 Via de la Valle, Suite G210 Del Mar, CA 92014 United States",General,General,,San Diego International Film Festival,https://sdfilmfest.com/,https://filmfreeway.com/SanDiegoFilmFestival,,10/13/2020,10/18/2020,San Diego,CA,3/13/2020,7/13/2020,,,,,x,,,,,,,,,,,,,,,,,,,,,,,,
590,8,"1775 Dove Lane Carlsbad, CA 92011",Children's,Children's,,San Diego International Kids Film Festival,https://www.sdkidsfilms.org/,https://filmfreeway.com/SDIKFF,Postponed to Oct or Nov,8/21/2020,8/23/2020,San Diego,CA,2/10/2020,7/31/2020,,,,,,,,,,,,,,,,,,,,,,,,,,x,,,
591,,"4126 Executive Drive La Jolla, CA 92037-1348 United States",Jewish,Jewish,,San Diego Jewish Film Festival,https://www.sdcjc.org/sdjff/,https://filmfreeway.com/SanDiegoJewishFilmFestival,,2/12/2020,2/23/2020,San Diego,CA,9/1/2019,9/1/2019,,,,,,,,,,x,,,,,,,,,,,,,,,,,,,
592,,"2921 El Cajon Boulevard San Diego, CA 92105 United States","Latino, Latin American (etc)",Latino/Latin American,,San Diego Latino Film Festival,http://sdlatinofilm.com/,https://filmfreeway.com/SanDiegoLatinoFilmFestival,Postponed,3/12/2020,3/22/2020,San Diego,CA,9/13/2019,11/15/2019,,,,,,,,,,,,,x,,,,,,,,,,,,,,,,
593,,"565 Pearl Street #100 La Jolla, CA 92037 United States",Misc. Niche,Misc. Niche,,San Diego Surf Film Festival,http://sdsurffilmfestival.com/,https://filmfreeway.com/SanDiegoSurfFilmFestival,Postponed,5/7/2020,5/9/2020,San Diego,CA,3/20/2020,3/20/2020,,,,,,,,,,,,,,,,,,,,,,,x,,,,,,
594,,"930 Tenth Avenue, San Diego, California 92101",Underground,Underground,,San Diego Underground Film Festival,https://www.sdundergroundarts.org/,https://filmfreeway.com/SanDiegoUndergroundFilmFestival,New Dates: Dec 4-6,8/20/2020,8/23/2020,San Diego,CA,12/1/2019,6/21/2020,,,,,,,,,,,,,,,,,,,x,,,,,,,,,,
986,10,"San Diego, CA",Misc. Niche,"Misc. Niche, Environment, Outdoor, Adventure, Wildlife",,San Diego UnderSea Film Exhibition,https://www.sdufex.com,https://filmfreeway.com/SanDiegoUnderSeaFilmExhibition,,tbd,tbd,San Diego,CA,tbd,tbd,,,,,,,,,,,,,,,,,,,,,,,x,x,,,,,
595,,"San Francisco, CA 94115","Black, African, Afr. Am. (etc)",Black/African/African American,,San Francisco Black Film Festival,http://sfbff.org/wordpress/,https://filmfreeway.com/sfbff,Switched to virtual,6/11/2020,6/14/2020,San Francisco,CA,12/1/2019,3/1/2020,,,,,,,,,,,x,,,,,,,,,,,,,,,,,,
596,,"2440 16th St #107 San Francisco, CA 93103 United States",Documentary,Documentary,,San Francisco Documentary Festival,http://sfindie.com/,https://filmfreeway.com/SanFranciscoDocumentaryFestival,Postponed; New dates TBD,6/4/2020,6/18/2020,San Francisco,CA,12/7/2019,4/1/2020,,,x,,,x,,,,,,,,,,,,,,,,,,,,,,,
597,,"588 Sutter St. #103 San Francisco, CA 94102",General,General,,San Francisco Frozen Film Festival,https://www.frozenfilmfestival.com/,https://filmfreeway.com/FrozenFilmFestival,Switched ot online - July 8-13,7/17/2020,7/21/2020,San Francisco,CA,8/31/2019,5/31/2020,,,,,x,,,,,,,,,,,,,,,,,,,,,,,,
598,10,"600 Embarcadero St San Francisco,, CA 94107","Misc. Ethnic, Cultural, Foreign Focus (etc)",Misc. Ethnic/Cultural/Foreign Focus,,San Francisco Greek Film Festival,http://grfilm.com/,https://filmfreeway.com/SanFranciscoGreekFilmFestival,,10/17/2020,10/24/2020,San Francisco,CA,5/1/2020,5/22/2020,,,,,,,,,,,,,,,,x,,,,,,,,,,,,,
1002,9,"429 Castro Street, San Francisco, California 94114 United States","Environment, Outdoor, Adventure, Wildlife","Environment, Outdoor, Adventure, Wildlife",,San Francisco Green Film Festival,https://www.greenfilmfest.org,https://filmfreeway.com/GreenFilmFest,,9/10/2020,9/20/2020,San Francisco,CA,2/23/2020,4/5/2020,,,x,,,,,,,,,,,,,,,,,,,,,x,,,,,
599,,"2440 16th St #107, San Francisco, CA 94103",General,General,,San Francisco Independent Film Festival,http://sfindie.com/festivals/sf-indiefest/,https://filmfreeway.com/SFIndieFest,,1/30/2020,2/13/2020,San Francisco,CA,6/1/2019,11/1/2019,,,x,,x,,,,,,,,,,,,,,,,,,,,,,,,
943,,"1746 Post Street, San Francisco, California 94115 United States",Short,Short,,San Francisco Independent Short Film Festival,https://sfindie.com,https://filmfreeway.com/SFIndieShorts,,9/25/2020,9/27/2020,San Francisco,CA,3/1/2020,8/14/2020,,,x,,,,x,,,,,,,,,,,,,,,,,,,,,,
600,,"39 Mesa Street, Suite 110, San Francisco, CA 94129",General,General,,San Francisco International Film Festival,https://www.sffilm.org,https://filmfreeway.com/SFFILMFestival,Canceled,4/8/2020,4/21/2020,San Francisco,CA,10/7/2019,12/9/2019,X,X,,,x,,,,,,,,,,,,,,,,,,,,,,,,
601,,"145 Ninth Street, #300, San Francisco, CA 94103 ",LGBTQ+,LGBTQ+,,San Francisco International LGBTQ+ Film Festival,https://www.frameline.org/,https://filmfreeway.com/Frameline,Postponed (fall dates TBD),6/18/2020,6/28/2020,San Francisco,CA,12/10/2019,2/29/2020,,,,,,,,,x,,,,,,,,,,,,,,,,,,,,
602,10,"561 San Mateo Ave., San Bruno, California 94066 United States",Misc. Niche,Misc. Niche,,San Francisco International New Concept Film Festival,http://www.sfnewfilm.org/,https://filmfreeway.com/SanFranciscoInternationalNewConceptFilmFestival,,10/26/2020,11/1/2020,San Bruno,CA,12/31/2019,8/31/2020,,,,,,,,,,,,,,,,,,,,,,,x,,,,,,
